https://www.marketsandmarkets.com/Market-Reports/enterprise-performance-management-market-114295566.html,"MarketsandMarkets forecasts the global Enterprise Performance Management (EPM) market size to grow from USD 7.28 billion in 2018 to USD 11.72 billion by 2023, at a Compound Annual Growth Rate (CAGR) of 10.0% during the forecast period. The EPM market report provides the competitive landscape and company profiles of the key vendors. The major vendors in the global EPM market include SAP (Germany), IBM (US), Oracle (US), Workiva (US), Adaptive Insights (US), Anaplan(US), Host Analytics (US), Infor (US), Longview (Canada), CCH Tagetik (Italy), Prevero (Germany), Prophix (Canada), Vena (Canada), Kaufman Hall (US), Deloitte (US), BOARD (Switzerland), Corporater (Norway), HCL (India), SAS Institute (US), MicroStrategy (US), Capgemini (France), CA Technologies (US), The Hackett Group (US), Emtec (US), and KPMG (UK).",11.72 billion,10.0%
https://www.marketsandmarkets.com/Market-Reports/cloud-workflow-market-207093879.html,"The cloud workflow market is expected to grow from USD 1.75 billion in 2018 to USD 3.85 billion by 2023, at a CAGR of 17.1% during the forecast period. It is expected to witness significant growth, due to factors such as the increasing adoption of cloud-based workflows, increasing adoption of cloud-based workflow from the SMEs, and the growing focus on streamlining workflows and business processes. The rising use of Artificial Intelligence (AI) presents new business opportunities, and growing focus on digital transformation initiatives are expected to provide growth opportunities for cloud workflow vendors. ",3.85 billion,17.1%
https://www.marketsandmarkets.com/Market-Reports/security-assurance-market-170362118.html,"MarketsandMarkets expects the security assurance market size to grow from USD 3.53 billion in 2018 to USD 5.48 billion by 2023, at a Compound Annual Growth Rate (CAGR) of 9.2% during the forecast period. The key players in the global security assurance market include Sogeti, a part of Capgemini (Sogeti), Avaya Inc. (Avaya), Content Security Pty Ltd. (Content Security), Radix Security Inc. (Radix Security), BizCarta Technologies India Pvt Ltd. (BizCarta), Infosys Limited (Infosys), OpenText Corporation (OpenText), Tenable Inc. (Tenable), Microsoft Corporation (Microsoft), Aura, an Independent Division Of Kordia Limited (Aura Information Security), SAS Institute Inc. (SAS), Happiest Minds Technologies (Happiest Minds), CIPHER Security LLC (CIPHER), IBM Corporation (IBM), Accenture plc (Accenture), Micro Focus International plc (Micro Focus), NETSCOUT Systems (NETSCOUT), Oracle Corporation (Oracle), Wipro Limited (Wipro), Telos Corporation (Telos), CRITICAL Software, Spirent Communications plc (Spirent Communications), and Signature Consulting Group, LLC (Signature Consulting).",5.48 billion,9.2%
https://www.marketsandmarkets.com/Market-Reports/risk-based-authentication-market-167648842.html,"MarketsandMarkets expects the global risk-based authentication market size to grow from USD 2.19 billion in 2018 to USD 5.41 billion by 2023, at a Compound Annual Growth Rate (CAGR) of 19.8% during the forecast period. Major vendors in the risk-based authentication market include IBM (US), CA Technologies (US), Micro Focus (UK), Okta (US), Gemalto (Netherlands), OneSpan (VASCO Data Security; US), SecureAuth (US), RSA Security (US), ForgeRock (US), Entrust Datacard (US), Ping Identity (US), LexisNexis (US), OneLogin (US), GURUCUL (US), Centrify (US), Equifax (US), Crossmatch (US), BioCatch (Israel), Oracle (US), Evidian (France), Identity Automation (US), NoPassword (US), Silverfort (Israel), iovation (US), and EZMCOM (US).",5.41 billion,19.8%
https://www.marketsandmarkets.com/Market-Reports/content-marketing-software-market-264192105.html,"MarketsandMarkets expects the global content marketing software market size to grow from USD 4.12 billion in 2018 to USD 9.59 billion by 2023, at a Compound Annual Growth Rate (CAGR) of 18.4% during the forecast period. Major vendors offering content marketing software across the globe include Oracle (US), Adobe (US), Salesforce (US), HubSpot (US), Alma Media (Finland), Curata (US), NewsCred (US), Contently (US), Percolate (US), Sprinklr (US), ScribbleLive (Canada), PathFactory (Canada), Uberflip (Canada), SnapApp (US), OneSpot (US), Skyword (US), Kenscio (India), DivvyHQ (US), Scoop.it (US), BrandMaker (Germany), Mintent (Canada), Kapost (US), Wedia (France), Vendasta (Canada), and Annex Cloud (US). These vendors have adopted various types of organic and inorganic growth strategies, such as new product launches, business expansions, partnerships and collaborations, and mergers and acquisitions, to expand their offerings and further expand their presence in the global content marketing software market.",9.59 billion,18.4%
https://www.marketsandmarkets.com/Market-Reports/cloud-pos-market-56647551.html,"Increasing business mobility, flexibility, and focus on efficient management of POS terminals across multiple locations are expected to spur the demand for cloud POS offerings across the globe. The global cloud POS market size is expected to grow at a CAGR of 22.7% during the forecast period, to reach USD 3.73 billion by 2023 from USD 1.34 billion in 2018. The report also studies various growth strategies, such as mergers and acquisitions, partnerships and collaborations, and developments, adopted by the major players to expand their presence in the global cloud POS market. Major vendors in the cloud POS market include Square, Inc. (US), Cegid (France), UTC RETAIL (US), Shop Keep (US), PAR Technology (US), Shopify (Canada), B2B Soft (US), Intuit (US), Lightspeed (Canada), Oracle (US), SalonTarget (US), RetailOps (US), Celerant Technology (US), TouchSuite (US), Clover (US), Revel Systems (US), ERPLY (US), Omnico Group (UK), Diaspark (US), Teamwork Retail (US), Jesta I.S. (Canada), One Step Retail Solutions (US), Phorest (Ireland), Poster POS (Poland), and iiko(Russia).","sing business mobility, flexibility, and focus on efficient management of POS terminals across multiple locations are expected to spur the demand for cloud POS offerings across the globe. The global cloud POS market size is expected to grow at a CAGR of 22.7% during the forecast period, to reach USD 3.73 billion",22.7%
https://www.marketsandmarkets.com/Market-Reports/account-based-marketing-market-224465009.html,"The global account-based marketing market size is expected to grow from USD 651.9 million in 2018 to USD 1,196.9 million by 2023, at a Compound Annual Growth Rate (CAGR) of 12.9% during the forecast period. Major growth drivers for the market include the focus on identifying the right audience, growth of social media and social advertising, and increased customer lifetime value.Demandbase (US), InsideView (US), 6Sense (US), Act-On Software (US), AdDaptive Intelligence (US), Albacross (Sweden), Celsius GKK International (France), Drift (US), Engagio (US), Evergage (US), HubSpot (US), Integrate (US), Iterable (US), Jabmo (France), Kwanzoo (US), Lattice Engines (US), Madison Logic (US), Marketo (US), MRP (US), Radius Intelligence (US), TechTarget (US), Terminus (US), Triblio (US), Uberflip (Canada), and Vendemore (Sweden).",,12.9%
https://www.marketsandmarkets.com/Market-Reports/service-analytics-market-21442175.html,"The service analytics market is expected to grow from USD 546.4 million in 2018 to USD 1,056.1 million by 2023, at a Compound Annual Growth Rate (CAGR) of 14.1% during the forecast period. Factors, such as the rise in the need for constant and effective interaction with customers to ensure prompt and proficient services and competitive pressure to become more data-driven are expected to drive the growth of the global service analytics market. Vendors providing service analytics software and services include Oracle (US), Salesforce (US), ServiceNow (US), SAP (Germany), SAS (US), Tableau (US), Microsoft (US), ClickSoftware (US), Centina Systems (US), Paskon (US), Numerify (US), Field Squared (US), Helpshift (US), Aureus Analytics (Singapore), NetEnrich (US), BlueFletch (US), mobi corp (US), DataHero (US), Agile CRM (US), Sisense (US), and MicroStrategy (US).",,14.1%
https://www.marketsandmarkets.com/Market-Reports/digital-evidence-management-market-137502457.html,"MarketsandMarkets forecasts the global digital evidence management market size to grow from USD 4.35 billion in 2018 to USD 7.56 billion by 2023, at a Compound Annual Growth Rate (CAGR) of 11.7% during the forecast period. Some of the major vendors in the digital evidence management market include Panasonic (Japan), Motorola (US), NICE (Israel), AcsessData (US), MSAB (Sweden), OpenText (Canada), Digital Detective (UK), Cellebrite (Israel), Paraben (US), QueTel (US), IBM (US), Oracle (US), Hitachi (Japan), Capita (UK), Vidizmo (US), Coban (US),Reveal Media (UK), Porter Lee Corporation (US), SoleraTec (US), VeriPIc (US), FileOnQ (US), Tracker Products (US), Intrensic (US), Foray (US), and WatchGuard (US).",7.56 billion,11.7%
https://www.marketsandmarkets.com/Market-Reports/cyber-security-market-505.html,"MarketsandMarkets forecasts the global cybersecurity market size to grow from USD 152.71 billion in 2018 to USD 248.26 billion by 2023, at a Compound Annual Growth Rate (CAGR) of 10.2% during the forecast period. The report encompasses the different strategies, such as mergers and acquisitions, partnerships and collaborations, business expansions, and product developments, adopted by the major players to increase their market share. Some of the major technology vendors in the cybersecurity market are IBM (US), Symantec (US), Check Point (US), Cisco (US), Imperva (US), CyberArk (Israel), Microsoft (US), Sophos (UK), Rapid 7 (US), F5 Networks (US), FireEye (US), Forcepoint (US), Juniper Networks (US), RSA Security (US), Fortinet (US), F-Secure (Finland), McAfee (US), Micro Focus (UK), Oracle (US), Palo Alto Networks (US), Proofpoint (US), Splunk (US), and Trend Micro (Japan). ",248.26 billion,10.2%
https://www.marketsandmarkets.com/Market-Reports/virtual-router-market-222860236.html,"The global virtual router market size is expected to grow from USD 116.8 million in 2018 to USD 331.5 million by 2023, at a Compound Annual Growth Rate (CAGR) of 23.2% during the forecast period. The major factors driving the growth of the virtual router market are the decrease in CAPEX and OPEX, increase in demand for SDN and NFV, and growing need for mobility. The major vendors in the global virtual router market are IBM (US), Cisco (US), Ericsson (Sweden), Huawei (China), Nokia (Finland), Juniper (US), netElastic (US), Brocade (US), HPE (US), Arista Networks (US), ZTE Corporation (China), Carbyne (Israel), Palo Alto Networks (US), Check Point Software (Israel), Ross Video (Canada), Inventum (India), Drivenets (Ha-Sharon), 128 Technology (US), TRENDnet (US), Linksys (US), TIME (Malaysia), ACCESS (Japan), Allied Telesis (Japan), Connectify (US), and 6WIND (France). ",,23.2%
https://www.marketsandmarkets.com/Market-Reports/route-optimization-software-market-197501388.html,"The route optimization software market size is expected to grow from to grow from USD 2.95 billion in 2018 to USD 5.07 billion by 2023, at a CAGR of 11.4% from 2018 to 2023. The major drivers of the route optimization software market include the increasing use of logistics-specific solutions and declining hardware and connectivity costs. Some of the major route optimization software vendors include ALK Technologies (US), AMCS (Ireland), Caliper (US), Descartes (Canada), Esri (US), FLS (Germany), Geoconcept (France), Google (US), Portatour (Austria), Llamasoft (US), Maxoptra (UK), Microlise (UK), Omnitracs (US), Optimoroute (US), ORTEC (Netherlands), Paragon Software (UK), PTV Group (Germany), Quintiq (Netherlands), FarEye (India), Route4me (US), RouteSolutions (US), Routific (Canada), Scientific Logistics (US), Truckstops (UK), Verizon Connect (US), and Workwave (US). ",5.07 billion,11.4%
https://www.marketsandmarkets.com/Market-Reports/task-management-software-market-171016683.html,"The global task management software market size is expected to grow from USD 2.27 billion in 2018 to USD 4.33 billion by 2023, at a Compound Annual Growth Rate (CAGR) of 13.7% during the forecast period. The major factors driving the market growth include the digital transformation initiatives that have led to improved IT systems to meet customers dynamic requirements. The major industry verticals in the market include Banking, Financial Services, and Insurance (BFSI); retail and consumer goods; and Information Technology (IT) and telecom; and real estate and construction. The major vendors offering task management software and services across the globe include Microsoft (US), Upland Software (US), Atlassian (Australia), Pivotal Software (US), RingCentral (US), Azendoo (France), Asana (US), Bitrix (US), Doist (Spain), monday.com (Israel), Quick Base (US), Redbooth (US), todo.vu (Australia), Teamwork.com (Ireland), Workfront (US), Wrike (US), Zoho (US), Airtable (US), Basecamp (US), Clarizen (US), Evernote Corporation (US), Inflectra (US), MeisterLabs (Austria), Smartsheet (US), and TimeCamp (US).",4.33 billion,13.7%
https://www.marketsandmarkets.com/Market-Reports/cloud-endpoint-protection-market-134229172.html,"The global cloud endpoint protection market is expected to grow from USD 1,014.4 million in 2018 to USD 1,819.0 million by 2023, at a Compound Annual Growth Rate (CAGR) of 12.4% during the forecast period. Cloud endpoint protection solutions are easy to use SaaS-based security solutions that protect and manage mobile devices and servers from a single console. The advancement in technologies and hacking methods has increased the need for endpoint security system that can learn quickly and defend against security threats in real time. Moreover, benefits such as cost-effectiveness and scalability have propelled the demand for cloud endpoint protection solutions across verticals. ",,12.4%
https://www.marketsandmarkets.com/Market-Reports/end-user-computing-market-60472493.html,"MarketsandMarkets forecasts the global End User Computing (EUC) market size to grow from USD 6.11 billion in 2018 to USD 11.17 billion by 2023, at a Compound Annual Growth Rate (CAGR) of 12.8% during the forecast period. The increasing demand for mobility solutions by organizations and the shift of organizations toward desktop virtualization infrastructures to increase the productivity and efficiency of employees by streamlining all these technologies through EUC solutions are expected to drive the adoption of EUC solutions and services. The major vendors in the EUC market include IGEL (Europe), Genpact (US), Tech Mahindra (India), Mindtree (India), Nucleus Software (India), Patriot Technologies (US), NetApp (US), Connection (US), HCL Infosystems (India), Synapse360 (UK), Hitachi Systems Micro Clinic (India), IDS (US), CSS Corp (India), SITA (Switzerland), Infosys (India), Data Integrity (Canada), Fujitsu (Japan), Focus Technology Solutions (US), SMP-Corp (US), Emerio (Singapore), Fortem Information Technology (UK), Serole Technologies (Australia), The Ergonomic Group (US), Coreio (Canada), and Emtec (US).",11.17 billion,12.8%
https://www.marketsandmarkets.com/Market-Reports/container-orchestration-market-13241043.html,"The container orchestration market size is expected to grow from USD 326.1 million in 2018 to USD 743.3 million by 2023, at a Compound Annual Growth Rate (CAGR) of 17.9% during the forecast period. Major growth drivers for the market include a large presence of open source vendors offering container orchestration platforms, cost-effectiveness and increased productivity in application deployment, greater flexibility than on-premises containers, and increasing traction of microservices architecture, and proliferation of container orchestration tools. Major vendors providing container orchestration platform and services include SUSE (UK), Oracle (US), Microsoft (US), Red Hat (US), AWS (US), Google (US), Docker (US), Mesosphere (US), Rancher Labs (US), Cisco (US), Critical Stack (US), Giant Swarm (Germany), Ericsson (US), Aptible (US), Kontena (Finland), SaltStack (US), Hashicorp (US), Shippable (US), Heroku (US), Joyent (South Korea), Pivotal Software (US), and Cloudify (US).",,17.9%
https://www.marketsandmarkets.com/Market-Reports/building-analytics-market-204179092.html,"MarketsandMarkets expects the global building analytics market size to grow from USD 5.94 billion in 2018 to USD 11.10 billion by 2023, at a Compound Annual Growth Rate (CAGR) of 13.3% during the forecast period. Major growth factors for the market include an increased demand for energy-efficient systems and a growing focus on decreasing operational cost requirement. Major vendors providing building analytics software and services include Honeywell, IBM, Johnson Controls, Schneider Electric, General Electric, Siemens, ENGIE Insight Services, Lucid, EnerNOC, BuildingIQ, ICONICS, Senseware, KGS Buildings, BuildingLogiX, Lutron Electronics, CopperTree Analytics, EcoVox, GridPoint, Energy Advantage, Delta Electronics, BuildPulse, Crestron Electronics, PointGrab, Verdigris, and NOVEDA Technologies. ",11.10 billion,13.3%
https://www.marketsandmarkets.com/Market-Reports/sip-trunking-services-market-84754280.html,"MarketsandMarkets forecasts the global Session Initiation Protocol (SIP) Trunking services market size to grow from USD 7.63 billion in 2018 to USD 12.70 billion by 2023, at a Compound Annual Growth Rate (CAGR) of 10.7% between 2018 and 2023. Major growth factors for the market include low Capital Expenditure (CAPEX) and Total Cost of Ownership (TCO), and an increasing adoption of cloud and Unified Communications (UC). Key players in the global SIP Trunking services market include AT&T (US), 8x8 (US), Bandwidth (US), BT Group (UK), CenturyLink (US), Colt (UK), Fusion (US), GTT Communications (US), IntelePeer (US), Mitel (Canada), Net2Phone (US), Nextiva (US), Orange (France), Rogers Communications (Canada), Sprint (US), Tata Communications (India), Telstra (Australia), Twilio (US), Verizon (US), Vodafone (UK), Vonage (US), Voyant Communications (US), West Corporation (US), and Windstream (US). ",12.70 billion,10.7%
https://www.marketsandmarkets.com/Market-Reports/certificate-authority-market-77821481.html,"MarketsandMarkets expects the global certificate authority market size to grow from USD 76.2 million in 2018 to USD 123.8 million by 2023, at a Compound Annual Growth Rate (CAGR) of 10.2% during the forecast period. Major drivers for the certificate authority market include the growing need to build trust among the expanding online customer base, an increasing awareness among internet users about secure web access, and adhering to stringent regulations and compliances. Major vendors covered in the certificate authority market include IdenTrust (US), Comodo CA (US), DigiCert (US), GoDaddy (US), GlobalSign (US), Asseco Data Systems (Poland), ACTALIS (Italy), Entrust Datacard (US), Trustwave (US), SSL.com (US), Network Solutions (US), TWCA (China), SwissSign (Switzerland), WISeKey (Switzerland), OneSpan (US), Buypass (Norway), Camerfirma (Spain), Hongkong Post (Hong Kong), EBG Information Technologies and Services (Turkey), Harica (Greece), Certigna (France), NETLOCK (Hungary), TURKTRUST (Turkey), certSIGN (Romania), and Disig (Slovakia). ",,10.2%
https://www.marketsandmarkets.com/Market-Reports/big-data-engineering-services-market-165583166.html,"The big data and data engineering services market is expected to grow from USD 34.47 billion in 2018 to USD 77.37 billion by 2023, at a Compound Annual Growth Rate (CAGR) of 17.6% during the forecast period. Major growth drivers for the market include increasing volumes of unstructured data due to phenomenal growth of interconnected devices and social media, cost-effective services and cutting-edge expertise rendered by boutique data servicing companies, and an increasing need for complying with stringent regulations. The report also covers different strategies, such as acquisitions, partnerships, new product launches, and product upgradations, adopted by the major players to increase their market shares. Major technology vendors include Accenture (Ireland), Genpact (US), Cognizant (US), Infosys (India), Capgemini (France), NTT DATA (Japan), Mphasis (India), L&T Technology Services (India), Hexaware (India), Happiest Minds (India), KPMG (Netherlands), EY (UK), Tiger Analytics (US), LatentView Analytics (US), InfoStretch (US), Vensai Technologies (India), Course5 (US), Sigmoid (US), Nous Infosystems (India), Bodhtree (US), Hidden Brains InfoTech (India), Brillio (US), Franz Inc. (US), BRIDGEi2i (India), and Trianz (US).",77.37 billion,17.6%
https://www.marketsandmarkets.com/Market-Reports/service-integration-management-market-243697815.html,"MarketsandMarkets expects the global Service Integration and Management (SIAM) market size to grow from USD 3.67 billion in 2018 to USD 4.85 billion by 2023, at a Compound Annual Growth Rate (CAGR) of 5.7% during the forecast period. Major players in the global SIAM market include IBM (US), Capgemini (France), HCL Technologies (India), DXC Technology (US), Atos (France), TCS (India), Wipro (India), Accenture (Ireland), Fujitsu (Japan), Mindtree (India), Oracle (US), NTT DATA (Japan), Quint Wellington Redwood (Netherlands), ServiceNow (US), and CGI (Canada). Other players include Cherwell (US), BAE Systems (UK), Infosys (India), Little Fish (England), Keysource (UK), Tieto (Finland), 4me (US), Data Ductus (Sweden), Sofigate (Finland), and Sopra Steria (France).",4.85 billion,5.7%
https://www.marketsandmarkets.com/Market-Reports/multi-vendor-support-services-market-251781478.html,"MarketsandMarkets forecasts the global Multi-Vendor Support Services (MVSS) market size to grow from USD 53.09 billion in 2018 to USD 60.14 billion by 2023, at a Compound Annual Growth Rate (CAGR) of 2.52% during the forecast period. Major growth factors for the MVSS market include the rapidly increasing changes in the IT infrastructure, rising maintenance costs of OEM services, reducing IT support and maintenance complexities, and regaining control of infrastructure support from OEMs. In addition to this, the increasing need for new levels of support services and growing use of centralized support services are other driving forces for the market. The global MVSS market is segmented by service type, business application, organization size, vertical, and region. The study measures and evaluates the major offerings and key strategies of the key market vendors, such as IBM (US), Dell (US), HP (US), Oracle (US), Fujitsu (Japan), NEC (Japan), Lenovo (China), Symantec (US), and Hitachi (Japan). These major companies have been offering reliable MVSS to their commercial clients across diverse locations.",60.14 billion,2.52%
https://www.marketsandmarkets.com/Market-Reports/hybrid-cloud-market-1150.html,"The hybrid cloud market is expected to grow USD 97.6 billion by 2023, at a Compound Annual Growth Rate (CAGR) of 17.0% during the forecast period. Major players in the hybrid cloud market are IBM (US), Microsoft (US), Cisco Systems (US), AWS (US), Oracle (US), Google (US), VMware (US), Alibaba (China), Equinix (US), Rackspace (US), NetApp (US), Atos (US), Fujitsu (Japan), CenturyLink (Louisiana), HPE (US), DXC (US), RightScale (US), Micro Focus (US), NTT Communications (Japan), Dell EMC (US), Citrix (US), Pure Storage (US), Unitas Global (US), and Quest Software(US). These players have adopted various growth strategies, such as new product launches, mergers and acquisitions, partnerships, collaborations, and business expansions, to expand their footprint in the hybrid cloud market.",brid cloud market is expected to grow USD 97.6 billion,17.0%
https://www.marketsandmarkets.com/Market-Reports/cognitive-data-management-market-174582873.html,"MarketsandMarkets forecasts the cognitive data management market to grow from USD 569.9 million in 2018 to USD 1,473.9 million by 2023, at a Compound Annual Growth Rate (CAGR) of 20.9% during the forecast period. The major factors expected to drive the cognitive data management market growth are the rising use of IoT-based devices, thereby resulting in the upshifting the amount of digital data, and growing adoption of the cognitive computing technology and advanced analytics. The key players in the cognitive data management market include Attivio (US), CognitiveScale (US), Cognizant (US), DATUM (US), Expert System (Italy), HPE (US), IBM (US), Immuta (US), Informatica &#8194;(US), Infosys (India), Kingland Systems (US), Microsoft (US), Oracle (US), Pingar (New Zealand), Reltio (US), Saksoft (India), Salesforce (US), SAP (Germany), SAS (US), SnapLogic (US), SparkCognition (US), StrongBox Data Solutions (Canada), Talend (US), Veritas (US), and Wipro (India). ",,20.9%
https://www.marketsandmarkets.com/Market-Reports/mea-cybersecurity-market-190673806.html,"MarketsandMarkets expects the MEA cybersecurity market size to grow from USD 15.66 billion in 2018 to USD 31.82 billion by 2023, at a Compound Annual Growth Rate (CAGR) of 15.2% during the forecast period. Major vendors in the MEA cybersecurity market include IBM (US) , CA Technologies (US), Check Point (US), Cisco (US), CyberArk (Israel), DarkMatter (UAE), DXC Technology (US), F5 Networks (US), FireEye (US), Forcepoint (US), Fortinet (US), Imperva (US), Kaspersky Lab (Russia), McAfee (US), Micro Focus (UK), Microsoft (US), Oracle (US), Palo Alto Networks (US), Proofpoint (US), Rapid7 (US), Sophos (UK), Splunk (US), Symantec (US), Trend Micro (Japan), and Trustwave (US).",31.82 billion,15.2%
