https://www.marketsandmarkets.com/Market-Reports/government-cloud-market-1170.html,"The government cloud market size is expected to grow from USD 15.40 Billion in 2017 to USD 28.85 Billion by 2022, at a Compound Annual Growth Rate (CAGR) of 13.4% during the forecast period. The major vendors providing government cloud solutions and services are Amazon Web Services (Washington, US), Microsoft (Washington, US), IBM (New York, US), Google (California, US), HPE (California, US), Oracle (California, US), Salesforce (California, US), Cisco Systems (California, US), Dell Technologies (Texas, US), VMware (California, US), Verizon (New York, US), CGI Group (Montreal, Canada), AT&T (Texas, US), SAP (Walldorf, Germany), NetApp (California, US), Informatica (California, US), Huddle (London, UK), Capgemini (Paris, France), CenturyLink (Louisiana, US), Citrix (Florida, US), Equinix (California, US), Fujitsu (Tokyo, Japan), NTT DATA (Tokyo, Japan), Red Hat (North Carolina, US), and NEC (Tokyo, Japan).",,13.4%
https://www.marketsandmarkets.com/Market-Reports/professional-services-automation-market-232788827.html,"The Professional Services Automation market size is expected to grow from USD 716.5 Million in 2017 to USD 1,244.8 Million by 2022, at a Compound Annual Growth Rate (CAGR) of 11.7% during the forecast period. Growing need for enhanced mobility among service consultants, and for scalable and flexible Professional Services Automation solutions is a major factor driving the growth of the market. Moreover, the increasing adoption of Professional Services Automation solutions by Small and Medium-sized Enterprises (SMEs) is expected to drive the market. The major vendors in the market include Autotask Corporation (US), Changepoint Corporation (US), FinancialForce (US), Microsoft (US), Atlassian (Australia), ConnectWise (US), Kimble Applications (UK), Mavenlink, Inc. (US), Oracle (US), SAP (Germany), Upland Software (US), Projector PSA (US), Project Open Business Solutions S.L (Spain), and Kaseya Limited (US).",,11.7%
https://www.marketsandmarkets.com/Market-Reports/workplace-services-market-164864528.html,"Workplace services covers the managed services adopted for workplace. The workplace services market size is projected to grow from USD 65.63 Billion in 2016 to USD 120.68 Billion by 2022, at a Compound Annual Growth Rate (CAGR) of 11.0% from 2017 to 2022. The major vendors providing workplace services are DXC Technology (US), Wipro (India), IBM (US), TCS (India), Atos (France), NTT DATA (Japan), HCL (India), Fujitsu (Japan), CompuCom (US), Cognizant (US), Unisys (US), Accenture (Ireland), Capgemini (France), T-Systems (Germany), Zensar (India), Getronics (the Netherlands), Computacenter (UK), Infosys (India), Tech Mahindra (India), Pomeroy (US), Insight Enterprises (US), Genpact (Bermuda), Long View Systems (Canada), Microland (India), and C3i (US).",,11.0%
https://www.marketsandmarkets.com/Market-Reports/web-application-firewall-market-176479811.html,"The Web Application Firewall (WAF) market size is expected to grow from USD 2.37 Billion in 2016 to USD 5.48 Billion by 2022, at a Compound Annual Growth Rate (CAGR) of 18.3% during the forecast period. The base year considered for the study is 2016 and the forecast period is from 2017 to 2022. There are several established players in the WAF market, such as Imperva, Akamai, Barracuda, Citrix, Cloudflare, DenyAll, Ergon Informatik, F5 Networks, Fortinet, Penta Security Systems , Radware, Trustwave, Sophos, Positive Technologies, StackPath, Zenedge, NSFOCUS, and Qualys.",,18.3%
https://www.marketsandmarkets.com/Market-Reports/user-provisioning-market-85056797.html,"The global user provisioning market size is expected to grow from USD 4.25 Billion in 2017 to USD 7.56 Billion by 2022, at a Compound Annual Growth Rate (CAGR) of 12.2%. The major forces driving the growth of the user provisioning market include the growing need for centrally managed, reliable user provisioning solutions and the increasing traction of security and risk mitigation. Moreover, the rising adoption of cloud-based Single Sign-On (SSO) and password management solutions is also a major factor driving the market growth. The major vendors in the user provisioning market include Oracle (US), Atos (France), IBM (US), Hitachi ID Systems (Canada), Dell (US), OneLogin (US), SAP (Germany), CA Technologies (US), Happiest Minds (India), EmpowerID (US), Microsoft (US), and Centrify Corporation (US).",,12.2%
https://www.marketsandmarkets.com/Market-Reports/containers-as-a-service-market-250080645.html,"The Containers as a Service (CaaS) market is expected to grow from USD 930.4 Million in 2017 to USD 4,080.4 Million by 2022, at a Compound Annual Growth Rate (CAGR) of 34.4%. The demand for CaaS is driven by many factors, such as benefits of cost-effectiveness, increased productivity, and increasing popularity of microservices. The major market vendors providing the CaaS technology are Apcera (California, US), AWS (Washington, US), Docker (California, US), Google (California, US), IBM (New York, US), and Microsoft (Washington, US).",,34.4%
https://www.marketsandmarkets.com/Market-Reports/network-transformation-market-158851537.html,"The network transformation market size is expected to grow from USD 4.28 Billion in 2016 to USD 66.86 Billion by 2022, at a Compound Annual Growth Rate (CAGR) of 61.9% during 20172022. The base year considered for the study is 2016 and the forecast period is from 2017 to 2022. The major vendors in the network security firewall market include Cisco, Juniper Networks, HPE, Huawei, IBM, NEC, Intel, Nokia Networks, Ericsson, FUJITSU, Accenture, and Mavenir.",,61.9%
https://www.marketsandmarkets.com/Market-Reports/geofencing-market-209129830.html,"The geofencing market accounted for USD 458.3 Million in 2016 ¬¬and is projected to reach USD 1,825.3 Million by 2022, at a Compound Annual Growth Rate (CAGR) of 27.5% during the forecast period. The major vendors in the geofencing market include Simpli.fi (US), Embitel (India) Thumbvista (US), Pulsate(US), Mobinius Technologies (India), Esri (US), Bluedot Innovation (US), GeoMoby (Australia), GPSWOX (UK), Apple (US), Localytics (US), MAPCITE (UK), Swirl Networks (US), DreamOrbit (India), Factual (US), InVisage (US), LocationSmart(US), MAPCITE(UK), Maven Systems (India), MobiOcean (India), Nisos Technologies(US), Urban Airship (US), plot projects (Netherlands), Raveon Technologies(US), and SuccorfishM2M (UK).",,27.5%
https://www.marketsandmarkets.com/Market-Reports/policy-management-in-telecom-market-62186207.html,"The policy management in telecom market is estimated to grow from USD 953.6 Million in 2017 to USD 1,617.1 Million by 2022, at a CAGR of 11.1% from 2017 to 2022. The market is primarily driven by the increasing adoption of tailored policy management solutions by telecom operators across the globe. Moreover, the rise in the demand for innovation in the telecom industry is also contributing to the growth of the policy management in telecom market. Major players in policy management in telecom market Ericsson (Sweden), Huawei (China), Nokia (Finland), Oracle (US), Amdocs (US), Netcracker Technology (UK), CSG International (US), ZTE (China), Cisco (US), Redknee (Canada), and Openet (Ireland).",,11.1%
https://www.marketsandmarkets.com/Market-Reports/hybrid-integration-platform-market-222940626.html,"The hybrid integration platform market is expected to grow from USD 17.14 Billion in 2017 to USD 33.60 Billion by 2022, at a Compound Annual Growth Rate (CAGR) of 14.4%, owing to the increasing need for digital business transformation among enterprises across various verticals. The major vendors providing hybrid integration platforms are Software AG (Darmstadt, Germany), Informatica (California, US), Dell Boomi (Pennsylvania, US), MuleSoft (California, US), IBM (New York, US), TIBCO Software (California, US), Oracle (California, US), Liaison Technologies (Georgia, US), WSO2 (California, US), SnapLogic (California, US), Red Hat (North Carolina, US), Axway (Puteaux, France), SEEBURGER (Bretten, Germany), Microsoft (Washington, US), RoboMQ (Virginia, US), Fiorano Software (California, US), Attunity (Israel), Cleo (Illinois, US), Actian (California, US), Adeptia (Illinois, US), Talend (California, US), Scribe Software (New Hampshire, US), elastic.io (Bonn, Germany), Built.io (California, US), and DBSync (Tennessee, US).",,14.4%
https://www.marketsandmarkets.com/Market-Reports/vehicle-analytics-market-67598601.html,"The vehicle analytics market size is expected to grow from USD 930.0 Million in 2016 to USD 3,637.4 Million by 2022, at a Compound Annual Growth Rate (CAGR) of 26.5%. The base year considered for this report is 2016 and the forecast period is 20172022. Major vendors in this market include Acerta Analytics Solutions (Canada), Agnik LLC (US), Amodo (Croatia), Automotive Rentals (ARI) (US), Azuga (US), C-4 Analytics, LLC (US), CloudMade (UK), Digital Recognition Network (US), EngineCAL (India), Genetec Inc.(Canada), HARMAN International (US), IBM (US), Inquiron (Dubai), INRIX (US), Inseego Corp. (US), Intelligent Mechatronic Systems (Canada), Microsoft (US), Noregon (US), Pivotal Software, Inc. (US), Plotly (Canada), Procon Analytics (US), SAP (Germany), Teletrac Navman (US), WEX Inc. (US), and Xevo Inc. (US).",,26.5%
https://www.marketsandmarkets.com/Market-Reports/bot-services-market-54449873.html,"The global bot services market size is expected to grow from USD 458.4 Million in 2017 to USD 1,783.9 Million by 2022, at a Compound Annual Growth Rate (CAGR) of 31.2%. Increasing user engagement on social media platforms and highly advanced Artificial Intelligence (AI) and Natural Language Processing (NLP) tools are boosting the growth of the bot services market across the globe. Some of the major vendors in the bot services market are Microsoft (US), IBM (US), Facebook (US), Google (US), Amazon Web Services (US), Nuance Communications (US), Aspect Software (US), Inbenta Technologies (US), Creative Virtual (UK), IPsoft (US), 24/7 Customer (US), CogniCor Technologies (Spain), Astute Solutions (US), Gupshup (US), Next IT Corp. (US), Kore.ai (US), Rasa Technologies GmbH (Germany), Pypestream (US), Avaamo (US), Pandorabots (US), LogMeIn (US), Artificial Solutions (Spain), Botego (Turkey), Chatfuel (US), Webio (Ireland), and Do You Dream Up (France). ",,31.2%
https://www.marketsandmarkets.com/Market-Reports/machine-learning-market-263397704.html,"The machine learning market size is expected to grow from USD 1.03 Billion in 2016 to USD 8.81 Billion by 2022, at a Compound Annual Growth Rate (CAGR) of 44.1% during the forecast period. Some of the major vendors are Microsoft Corporation (Washington, US), IBM Corporation (New York, US), SAP SE (Walldorf, Germany), SAS Institute Inc. (North Carolina, US), Google, Inc. (California, US), Amazon Web Services Inc. (Washington, US), Baidu, Inc. (Beijing, China), BigML, Inc. (Oregon, US), Fair Isaac Corporation (FICO) (California, US), Hewlett Packard Enterprise Development LP (HPE) (California, US), Intel Corporation (California, US), KNIME.com AG (Zurich, Switzerland), RapidMiner, Inc. (Massachusetts, US), Angoss Software Corporation (Toronto, Canada), H2O.ai (California, US), Alpine Data (California, US), Domino Data Lab, Inc. (California, US), Dataiku (Paris, France), Luminoso Technologies, Inc. (Massachusetts, US), TrademarkVision (Pennsylvania, US), Fractal Analytics Inc. (New Jersey, US), TIBCO Software Inc. (California, US), Teradata (Ohio, US), Dell Inc. (Texas, US), and Oracle Corporation (California, US).",,44.1%
https://www.marketsandmarkets.com/Market-Reports/ai-in-fintech-market-34074774.html,"The AI in Fintech market size is expected to grow from USD 959.3 Million in 2016 to USD 7,305.6 Million by 2022, at a Compound Annual Growth Rate (CAGR) of 40.4%. The AI in Fintech market report encompasses the competitive landscape, which presents the positioning of the 25 key AI in Fintech vendors, based on their product offerings and business strategies. Some of the major vendors are Microsoft (Washington, US), Google (California, US), Salesforce.com (California, US), IBM (New York, US), Intel (California, US), Amazon Web Services (Washington, US), Inbenta Technologies (California, US), IPsoft (New York, US), Nuance Communications (Massachusetts, US), and ComplyAdvantage.com (New York, US).",,40.4%
https://www.marketsandmarkets.com/Market-Reports/cloud-field-service-management-market-62396319.html,"The cloud Field Service Management (FSM) market size accounted for USD 903.7 Million in 2016 and is projected to reach USD 2,254.5 Million by 2022, at a Compound Annual Growth Rate (CAGR) of 17.3% during the forecast period. The major vendors providing cloud FSM services are Industrial and Financial Systems AB (Sweden, Europe), ServiceNow, Inc. (California, US), Salesforce.com, Inc. (California, US), SAP SE (Germany, Europe), Oracle Corporation (California, US), International Business Machines Corporation (New York, US), ServicePower Technologies plc (Cheshire, UK), ClickSoftware Technologies Ltd. (Massachusetts, US), ServiceMax, Inc. (California, US), Acumatica, Inc. (Washington, US), Microsoft Corporation (Washington, US), and Astea International Inc. (Pennsylvania, US).",,17.3%
https://www.marketsandmarkets.com/Market-Reports/api-testing-market-227082545.html,"The global API testing market size is expected to grow from USD 384.3 Million in 2016 to USD 1,099.1 Million by 2022, at a Compound Annual Growth Rate (CAGR) of 19.69% from 2017 to 2022. Major vendors in the API testing market are Astegic (Virginia, US), Axway (Arizona, US), Bleum (Shanghai, China), CA Technologies (New York, US), Cigniti Technologies (Hyderabad, India), Cygnet Infotech (Ahmedabad, India), IBM (New York, US), Inflectra Corporation (Maryland,US), Infosys (Bengaluru, India), Load Impact (Stockholm, Sweden), LogiGear Corporation (California, US), Micro Focus(Formerly HPE) (Berkshire, UK), Nevatech (Georgia, US), Oracle (Apiary) Corporation (California, US), Parasoft Corporation (California, US), QASource (California, US), QSG Technologies (Bengaluru, India), QualityLogic (Idaho, US), SmartBear Software (Massachusetts, US), SendGrid, Inc. (Colorado, US), Sybrant Technologies (Chennai, India), Runscope (California, US), Trantor (California, US), Tricentis (Vienna, Austria), and Vector Software (Rhode Island, US).",,19.69%
https://www.marketsandmarkets.com/Market-Reports/microquadrant-public-safety-security-55103888.html,"The public safety and security points to the welfare and safeguarding of public from physical as well as cyber threats. The public safety and security solutions help avert and minimize the impact of terrorist attacks, cyber-attacks, and natural disasters on the economy. Most states around the world have public safety departments and agencies whose primary responsibility is to deploy public safety and security solutions to protect the public and limit the effects of criminal attacks and natural calamities. The citizens are usually dependent on the government and public departments for their day-to-day requirements.",,
https://www.marketsandmarkets.com/Market-Reports/embedded-analytics-market-227756398.html,"Embedded analytics enables business users to access business data and analyze them at any place and any time to generate insights within an application, even though they do not have data science and analytical skills. The embedded analytics market size is expected to grow from USD 24.36 Billion in 2016 to USD 51.78 Billion by 2022, at a Compound Annual Growth Rate (CAGR) of 14.1%. 2016 is considered to be the base year, while the forecast period is 20172022. The report also encompasses different strategies, such as mergers and acquisitions, partnerships and collaborations, and product developments, adopted by the major players to increase their shares in the market. Some of the major technology vendors include Microsoft Corporation (US), IBM (US), SAP SE (Germany), SAS Institute (US), Oracle Corporation (US), MicroStrategy Incorporated (US), Tableau Software (US), TIBCO Software (US), Birst (US), Logi Analytics (US), QlikTech International (US), Sisense (US), Information Builders (US), OpenText (Canada), and Yellowfin International (Australia).",,14.1%
https://www.marketsandmarkets.com/Market-Reports/messaging-security-market-41963086.html,"MarketsandMarkets expects the messaging security market size to grow from USD 2.64 Billion in 2017 to USD 5.50 Billion by 2022, at a Compound Annual Growth Rate (CAGR) of 15.8%. Major vendors in the messaging security market include McAfee LLC (US), Cisco Systems, Inc. (US), Trend Micro Incorporated (Japan), Symantec Corporation (US), Proofpoint Inc. (US), Forcepoint (US), Microsoft Corporation (US), Sophos Ltd. (UK), Barracuda Networks Inc. (US), F-Secure Corporation (Finland), Trustwave Holdings, Inc. (US), Mimecast Limited (UK), Check Point Software Technologies Ltd. (Israel), Adaptive Mobile Security Limited (Ireland), GWAVA, Inc. (Canada), GreatHorn, Inc. (US), E-lock (US), Retarus Group (Germany), Clearswift Group (UK), Google Inc. (US), Total Defense Inc. (US), Fortinet, Inc. (US), Panda Security, S.L. (Spain), and SonicWall Inc. (US).",,15.8%
https://www.marketsandmarkets.com/Market-Reports/computer-aided-dispatch-market-4669389.html,"The Computer Aided Dispatch market is expected to grow from USD 1.12 Billion in 2017 to USD 1.95 Billion by 2022, at a Compound Annual Growth Rate (CAGR) of 11.8%. The major vendors in the Computer aided dispatch market include IMPACT (US), Avtec Inc. (US), Caliber Public Safety (US), Zetron, Inc. (US), TriTech Software Systems (US), Superion (US), Hexagon Safety & Infrastructure (US), Spillman Technologies, Inc. (US), Priority Dispatch Corp. (US), Tyler Technologies, Inc. (US), Southern Software, Inc. (US), CODY Systems (US), Traumasoft (US), DoubleMap (US), NowForce (Israel), and FDM Software (Aptean) (Canada).",,11.8%
https://www.marketsandmarkets.com/Market-Reports/cloud-encryption-market-158713019.html,"The cloud encryption market is expected to grow from USD 529.5 Million in 2016 to USD 2,401.9 Million by 2022, at a Compound Annual Growth Rate (CAGR) of 30.1% during the forecast period. The major vendors providing cloud encryption solutions and services are Thales e-Security (La Defense, France), Gemalto N.V. (Amsterdam, Netherlands), Sophos Group plc (Abingdon, UK), Symantec Corporation (California, US), Skyhigh Networks (California, US), Netskope Inc. (California, US), CipherCloud (California, US), HyTrust, Inc. (California, US), Trend Micro Incorporated (Tokyo, Japan), Vaultive, Inc. (Massachusetts, US), and TWD Industries AG (Unteriberg, Switzerland).",,30.1%
https://www.marketsandmarkets.com/Market-Reports/iot-data-management-market-53767032.html,"The global IoT data management market size expected to grow from USD 23.8 Billion in 2016 to USD 66.44 Billion by 2022, at a Compound Annual Growth Rate (CAGR) of 19.3%. The major vendors in the IoT data management market include International Business Machines (IBM) Corporation (US), PTC Inc. (US), Teradata Corporation (US), Dell Technologies, Inc. (US), Cisco Systems, Inc. (US), SAS Institute Inc. (US), Hewlett Packard Enterprise (HPE) Company (US), Fujitsu Limited (Japan), Oracle Corporation (US), Google Inc. (US), SAP SE (Germany), LogMeIn, Inc. (US), Striim, Inc. (US), Zebra Technologies Corporation (US), LogFuze Inc. (US), InfluxData, Inc. (US), Trustwave Holdings, Inc. (US), and MuleSoft, Inc. (US).",,19.3%
https://www.marketsandmarkets.com/Market-Reports/mobile-edge-computing-market-10135317.html,"The Mobile Edge Computing market is expected to grow from USD 148.2 Million in 2016 to USD 838.6 Million by 2022, at a Compound Annual Growth Rate (CAGR) of 35.2% during the forecast period. The major vendors providing Mobile Edge Computing technology are Adlink Technology Inc. (Taiwan), Advantech Co., Ltd. (Taiwan), Artesyn Embedded Technologies Inc. (California, US), Brocade Communications Systems, Inc. (California, US), Huawei Technologies Co., Ltd. (Shenzhen, China), Juniper Networks, Inc. (California, US), Nokia Corporation (Espoo, Finland), Saguna Networks Ltd. (Israel), Vapor IO, Inc. (Texas, US), and Vasona Networks, Inc. (California, US).",,35.2%
https://www.marketsandmarkets.com/Market-Reports/cloud-engineering-market-145753946.html,"The cloud engineering market is expected to grow from USD 4.20 Billion in 2016 to USD 13.43 Billion by 2022, at a Compound Annual Growth Rate (CAGR) of 23.2% during the forecast period. The major vendors providing cloud engineering services are Sogeti (France, Europe), Aricent Inc. (California, US), Trianz (California, US), GFT Technologies SE (Germany, Europe), ITC Infotech India Ltd. (Karnataka, India), Engineering Ingegneria Informatica SpA (Rome, Europe), RapidValue Solutions Inc. (California, US), Nitor Infotech (Maharashtra, India), Softcrylic LLC (Minnesota, US), Calsoft Inc. (California, US), Searce Inc. (Texas, US), and VVDN Technologies (Haryana, India). These players have adopted various strategies, such as new product developments, mergers and acquisitions, collaborations, and partnerships, to expand their presence in the global cloud engineering market.",,23.2%
https://www.marketsandmarkets.com/Market-Reports/anomaly-detection-market-138133262.html,"The anomaly detection market size is expected to grow from USD 2.08 Billion in 2017 to USD 4.45 Billion by 2022, at a Compound Annual Growth Rate (CAGR) of 16.4%. The major vendors in the anomaly detection market include Wipro Limited (India), Cisco Systems, Inc. (US), International Business Machines Corporation (US), Hewlett Packard Enterprise Company (US), Dell Technologies, Inc. (US), SAS Institue, Inc. (US), Symantec Corporation (US), Anodot (Israel), Happiest Minds (India), and Guardian Analytics (US). ",,16.4%
https://www.marketsandmarkets.com/Market-Reports/apac-project-portfolio-management-market-102795459.html,"The APAC Project Portfolio Management (PPM) market size is expected to grow from 522.0 Million in 2016 to USD 1,352.8 Million by 2022, at a Compound Annual Growth Rate (CAGR) of 18.2%. The major PPM vendors in APAC are Upland Software, Inc. (Texas, US), Planview, Inc. (Texas, US), Planisware S.A.S. (California, US), Oracle Corporation (California, US), Software AG (Darmstadt, Germany), SAP SE (Walldorf, Germany), Microsoft Corporation (Washington, US), Changepoint Corporation (Washington, US), CA Technologies (New York, US), Hewlett Packard Enterprise Company (California, US), Clarizen (California, US), and ServiceNow, Inc. (California, US). ",,18.2%
https://www.marketsandmarkets.com/Market-Reports/legal-analytics-market-85524032.html,"The global legal analytics market is projected to grow from USD 451.1 Million in 2017 to USD 1,858.9 Million by 2022, at a Compound Annual Growth Rate (CAGR) of 32.7% during the forecast period. The report encompasses the competitive landscape, which presents the positioning of 18 key vendors of legal analytics solutions and services, based on their product offerings and business strategies. Some of the major solution and service vendors include the Wolters Kluwer (Netherlands), Thomson Reuters (Canada), MindCrest, Inc. (US), UnitedLex Corporation (US), Argopoint LLC (US), LexisNexis (US), PREMONITION (US), CPA Global (UK), Analytics Consulting LLC (US), The Bureau of National Affairs (BNA) Inc. (US), IBM Corporation (US), and Wipro Limited (India).",,32.7%
https://www.marketsandmarkets.com/Market-Reports/payment-security-market-181519578.html,"The payment security market size is expected to grow from USD 11.39 Billion in 2017 to USD 24.63 Billion by 2022, at a Compound Annual Growth Rate (CAGR) of 16.7%. The base year considered for the study is 2016, and the market size is calculated from 2017 to 2022. The major vendors in the payment security market include Braintree (Illinois, US), CyberSource Corporation (California, US), Elavon (Georgia, US), Index (Nevada, US), Ingenico ePayments (Hoofddorp, Netherlands), Intelligent Payments (Gibraltar), GEOBRIDGE Corporation (Virginia, US), Shift4 Corporation (Nevada, US), Transaction Network Services (TNS) Inc. (Virginia, US), and TokenEx, LLC (Oklahoma, US).",,16.7%
https://www.marketsandmarkets.com/Market-Reports/lecture-capture-systems-market-138446242.html,"The global lecture capture systems market size is expected to grow from USD 2.24 Billion in 2017 to USD 9.39 Billion by 2022, at a Compound Annual Growth Rate (CAGR) of 33.19%. Some of the major vendors in the lecture capture systems market are Kaltura, Inc. (US), Echo360, Inc. (US), Panopto (US), Sonic Foundry, Inc. (US), VBrick (US), YuJa Corporation (US), McGraw-Hill Education, Inc. (US), Crestron Electronics, Inc. (US), VIDIZMO LLC (US), UbiCast (France), Telestream, LLC (US), Qumu (US), TechSmith Corporation (US), Cattura Video (US), ShareStream LLC (US), Polycom, Inc. (US), Cisco Systems, Inc. (US), TELTEK Video Research (Spain), Epiphan Systems, Inc. (Canada), PowerCreator Info & Tech Co., Ltd. (China), Winnov, Inc. (US), Lumens Digital Optics, Inc. (Taiwan), Matrox (Canada), and HABOOK Information Technology, Inc. (Taiwan). ",,33.19%
https://www.marketsandmarkets.com/Market-Reports/contact-center-analytics-market-115741185.html,"The contact center analytics market is expected to grow from USD 709.5 Million in 2017 to USD 1,483.6 Million by 2022, at a Compound Annual Growth Rate (CAGR) of 15.9%. Major contact center analytics vendors include Cisco Systems, Inc. (US), Genpact Limited (Bermuda), Verint Systems Inc. (US), 8X8 Inc. (US), Genesys (US), Oracle Corporation (US), Mitel Networks Corporation (Canada), SAP SE (Germany), NICE Ltd. (Israel), Enghouse Interactive (US), Five9, Inc. (US), CallMiner (US), and Servion Global Solutions (India).",,15.9%
