https://www.marketsandmarkets.com/Market-Reports/asset-performance-management-market-72801714.html,"MarketsandMarkets estimates the global Asset Performance Management (APM) market size is expected to grow USD 6.7 billion by 2025, at a Compound Annual Growth Rate (CAGR) of 15.1% during the forecast period. Some prominent players across all service types profiled in the asset performance management market study are ABB (Switzerland), SAP (Germany), GE Digital (US), IBM (US), AVEVA (UK), OSIsoft (US), Bentley Systems (US), Siemens (Germany), Oracle (US), Infor (US), AspenTech (US), DNV GL (Norway), eMaint (US), Nexus Global (US), Accruent (US), Aptean (US), Operational Sustainability (US), Rockwell Automation (US), ARMS Reliability (Australia), IPS (Germany) and Uptake Technologies (US). ",sandMarkets estimates the global Asset Performance Management (APM) market size is expected to grow USD 6.7 billion,15.1%
https://www.marketsandmarkets.com/Market-Reports/covid-19-impact-on-cloud-computing-market-86614844.html,"The COVID-19 Impact on Cloud Computing Market is expected to grow from USD 233 billion in 2019 to USD 295 billion by 2021, at a CAGR of 12.5% during the forecast period. The major cloud market vendors includes AWS (US), Microsoft (US), Google (US), Alibaba (China), SAP (Germany), IBM (US), Oracle (US), VMware (US), Rackspace (US), Salesforce (US), Adobe (US), Verizon (US), CenturyLink (US), Fujitsu (Japan), NTT Communications (Japan), Cisco (US), Dell (US), Equinix (US), HPE (US), Inspur (China), Cyrusone (US), Digital Relty (US), Lenovo (Hong Kong), Tencent (China), SAP (US), Cloudbees (US), Servicenow (US), Mendix (US), Engine Yard (US), ADP (US), Workday (US), Ringcentral (US), Mitel (Canada), 8x8 (US), Slack (US), Zoom (US), Docusign (US), Citrix (US), Okta (US), Nextiva (US), Intermedia (US), CrowdStrike (US), Carbonite (US), Cyberark (US), Infosys (India), Accenture (Ireland), Capgemini (France), TCS (India), AT&T (US), T-Mobile (US), and Vodafone (United Kingdom).",295 billion,12.5%
https://www.marketsandmarkets.com/Market-Reports/iot-cloud-platform-market-195182.html,"MarketsandMarkets forecasts the global Internet of Things (IoT) cloud platform market size is expected to grow USD 11.5 billion by 2025, at a Compound Annual Growth Rate (CAGR) of 12.6% during the forecast period. Key and emerging market players in the US IoT cloud platform market include AWS (US), Microsoft (US), Google (US), Cisco Systems (US), IBM (US), Oracle (US), Salesforce.com (US), PTC (US), Autodesk (US), AT&T (US), GE Digital (US), Zoho Corporation (US), and Particle (US). These players have adopted various business growth strategies to grow in the global IoT cloud platform market.",sandMarkets forecasts the global Internet of Things (IoT) cloud platform market size is expected to grow USD 11.5 billion,12.6%
https://www.marketsandmarkets.com/Market-Reports/covid-19-impact-on-analytics-market-11024881.html,"The COVID-19 impact on the global analytics market size is expected to grow USD 33.8 billion by 2021, at a Compound Annual Growth Rate (CAGR) of 15.5% during the forecast period. The report includes the study of the key players offering analytics solutions and services. Major vendors in the global analytics market include Microsoft (US), Teradata (US), IBM (US), Oracle (US), SAS Institute (US), Google (US), Adobe (US), Talend (US), Qlik (US), TIBCO Software (US), Alteryx (US), Sisense (US), Informatica (US), Splunk (US), Hitachi Vantara (US), Information Builders (US), AWS (US), SAP (Germany), Salesforce (US), Micro Focus (UK), MicroStrategy (US), Gorilla Technology (US), and ThoughtSpot (US). ",VID-19 impact on the global analytics market size is expected to grow USD 33.8 billion,15.5%
https://www.marketsandmarkets.com/Market-Reports/covid-19-impact-on-cybersecurity-market-128702677.html,"The Covid-19 Impact On Cybersecurity Market is expected to grow from USD 183.2 billion in 2019 to USD 230.0 billion by 2021, at a CAGR of 12.0% during the forecast period. Major vendors in the global cybersecurity market include Acunetix (Malta), ABB (Switzerland), Airbus (France), Belden (US), Baker Hughes (US), Microsoft (US), CrowdStrike (US), Symantec (US), TrendMicro (Japan), Sophos (UK), McAfee (US), Kaspersky (Russia), K7 Computing (India), ESET (Slovakia), Cisco (US), FireEye (US), F-Secure (Finland), Palo Alto Networks (US), Check Point Software (Israel), Fortinet (US), CyberArk (US), Cyberbit (Israel), Checkmarx (Israel), Rockwell Automation (US), CloudFlare (US), Vercaode (US), Pradeo (France), Rapid7 (US), Synopsys (US), Trustwave (US), WhiteHat Security (US), ImmuniWeb (High-Tech Bridge SA) (Switzerland), Contrast Security (US), Qualys (US), SiteLock (US), Sophos (UK), IBM (US), Imperva (US), CipherCloud Inc. (US), ZScaler Inc. (US), Avanan Inc. (US), Oracle (US), Thales (France), Micro Focus (UK), Fortinet (US), Imperva (US), Citrix (US), Juniper Networks (US), Akamai (US), Avaya (US), DXC Technology (US), Nokia (Finland), and Zscaler (US).",230.0 billion,12.0%
https://www.marketsandmarkets.com/Market-Reports/covid-19-impact-on-iot-market-212332561.html,"The Covid-19 Impact on Internet of Things (IoT) Market is expected to grow from USD 150 billion in 2019 to USD 243 billion by 2021, at a CAGR of 13.7% during the forecast period. The major Internet of Things market vendors includes IBM (US), Royal Phillips (Netherlands), Stanley Healthcare (US), Microsfot (US), Oracle (US), Bosch (Germany), CloudMinds (US), XAG (China), CBT (US), PTC PTC (US), Rockwell Automation (US), Honeywell (US), GE Digital (US), Intel (US), Siemens (Germany), Ericsson (Sweden), Hitachi Vantara (US), ABB (Switzerkland), NEC Corporation (Japan), Telit (UK), Sierra Wireless (Canada), Itron (US), Arad Group (Israel), Cisco (US), Medtronic (Ireland), SAP (Germany), Software AG (Germany) AWS (US), Softweb Solutions (US), Google (US), hIOTron (India), Sony(Japan), Capgemini (France), Adobe (US), NTT Communications (Japan), Happiest Minds (India), Vodafone (UK), TCS (India), DXC (US), Infosys (India), Verizon (US), Service Group (US), Cognizant (US), and Accenture (Ireland).",243 billion,13.7%
https://www.marketsandmarkets.com/Market-Reports/low-code-development-platforms-market-103455110.html,"The low-code development platform market is expected to grow from USD 13.2 billion in 2020 to USD 45.5 billion by 2025 at a compound annual growth rate (CAGR) of 28.1% during the forecast period.The vendors covered in the market report include Salesforce (US), Microsoft (US), Appian (US), Oracle (US), Pegasystems (US), Magic Software Enterprises (US), AgilePoint (US), OutSystems (US), Zoho (India), Quick Base (US), LANSA (US), Fujitsu RunMyProcess (France), Netcall (UK), WaveMaker (US), and K2 (US).",45.5 billion,28.1%
https://www.marketsandmarkets.com/Market-Reports/critical-infrastructure-protection-cip-market-988.html,"The Critical Infrastructure Protection (CIP) market is expected to grow from USD 128.9 billion in 2020 to USD 152.3 billion by 2025 at a compound annual growth rate (CAGR) of 3.4% during the forecast period.BAE Systems (UK), Lockheed Martin (US), General Dynamics (US), Northrop Grumman (US), Honeywell (US), Airbus (France), Raytheon (US), Thales (France) , Hexagon AB (Sweden), Johnson Controls (US), Huawei (China), Optasense (England), Teltronic (Spain), Motorola Solutions (US), Axis Communications (Sweden), Waterfall Security Solutions (Israel), Rolta (India), SCADAfence (Israel), Tyco International (Ireland), and 3xLogic (US).",152.3 billion,3.4%
https://www.marketsandmarkets.com/Market-Reports/visitor-management-system-market-101431341.html,"The visitor management system market is expected to grow from USD 848 million in 2020 to USD 1,640 million in 2025 at a compound annual growth rate (CAGR) of 14.1% during the forecast period.The visitor management system market comprises key solution providers, such as Honeywell (US), AlertEnterprise (US), SmartSpace Software plc (Bedfordshire), Genetec (Canada), Envoy (US), iLobby (Canada), Jolly Technologies (US), Vuetura (US), Asiatact (Singapore), Splan (US), Digicred Technologies (India), Veristream (US), Traction Guest (Canada), Proxyclick (Belgium), InVentry (Yorkshire), WhosOnLocation (New Zealand), Qminder (UK), Parabit System (US), Sine (Australia), and VersionX Innovations (Singapore).",,14.1%
https://www.marketsandmarkets.com/Market-Reports/healthcare-lifesciences-nlp-market-131821021.html,"The Natural Language Processing (NLP) in Healthcare and Life Sciences Market is expected to grow from USD 1.5 billion in 2020 to USD 3.7 billion by 2025, at a CAGR of 20.5% during the forecast period. The report includes the study of the key players offering NLP solutions and services in healthcare and life sciences industry. The major vendors includes 3M (US), Cerner (US), Nuance (US), Health Fidelity (US), Dolbey (US), Microsoft (US), IBM (US), Google (US), AWS (US), Apixio (US), Averbis (Germany), Linguamatics (UK), Clinithink (Georgia), Wave Health Technologies (Georgia), Inovalon (US), and Lexalytics (US). It also includes an in-depth competitive analysis of the key players in the NLP in healthcare and life sciences market, along with their company profiles, business overviews, product offerings, recent developments, and market strategies.",3.7 billion,20.5%
https://www.marketsandmarkets.com/Market-Reports/marketing-resource-management-market-23114879.html,"The Marketing Resource Management Market is expected to grow from USD 2.9 billion in 2020 to USD 5.0 billion by 2025, at a CAGR of 11.8% during the forecast period. The global market comprises major solution providers, such as SAP (Germany), SAS (US), Aprimo (US), BrandMaker (Germany), Workfront (US), HCL Technologies (India), Oracle (US), Percolate (US), Allocadia (Canada), Adobe (US), Infor (US), Northplains (Canada), Broadridge (US), Sitecore (US), Contentserv (Switzerland), Bynder (US), censhare (Germany), MarcomCentral (US), Elateral (UK), Capital ID (Netherlands), Wedia (France), NewsCred (US), inMotionNow (US), and Simple (Australia). The study includes the in-depth competitive analysis of key players in the MRM market with their company profiles, recent developments, and key market strategies.",5.0 billion,11.8%
https://www.marketsandmarkets.com/Market-Reports/cloud-applications-market-77759796.html,"The Cloud Applications Market is expected to grow from USD 171 billion in 2020 to USD 356 billion by 2025, at a CAGR of 15.9% during the forecast period. Major vendors offering cloud applications across the globe includes Microsoft (US), Salesforce (US), Oracle (US), SAP (Germany), Google (US), Workday (US), Adobe (US), IBM (US), Infor (US), Sage Group (UK), Intuit (US), Epicor (US), IFS (Sweden), ServiceNow (US), OpenText (US), Cisco (US), Box (US), Zoho (US), Citrix (US), LogMeIn (US), and Upland Software (US).",356 billion,15.9%
https://www.marketsandmarkets.com/Market-Reports/3d-imaging-market-998.html,"The 3D Imaging Market is expected to grow from USD 15.5 billion in 2020 to USD 41.0 billion by 2025, at a CAGR of 21.5% during the forecast period. The major vendors includes GE Healthcare (US), Autodesk (US), STMicroelectronics (Switzerland), Panasonic (Japan), and Sony (Japan), Philips (Netherland), Trimble (US), FARO (US), , Google (US), Adobe (US), HP (US), Dassault Systèmes (France), Lockheed Martin (US), Topcon (Japan), Able Software (US), Maxon (Germany), Esri (US), Bentley Systems (US), Pixologic (US), Pix4D (Switzerland). It also includes an in-depth competitive analysis of the key players in the 3D imaging market, along with their company profiles, business overviews, product offerings, recent developments, and market strategies.",41.0 billion,21.5%
https://www.marketsandmarkets.com/Market-Reports/revenue-assurance-market-93599016.html,"The revenue assurance market size is Expected to grow USD 782 million by 2025, at a Compound Annual Growth Rate (CAGR) of 8.9% during the forecast period. Major vendors of revenue assurance include Amdocs (US), Araxxe Inc. (US), Adapt IT (South Africa), Cartesian (US), Digital Route (Sweden), eClerx (India), HPE (US) Itron (US), Nokia (Finland), Profit Insight (US), Sagacity Solutions (UK), Sandvine (Canada), Sigos (Germany), Subex (India), Synthesis Systems (US), TCS (India), Teoco (US), Transunion, (US), and WeDo (Portugal), and Xintec (Ireland).",,8.9%
https://www.marketsandmarkets.com/Market-Reports/customer-analytics-market-250688798.html,"The Customer Analytics Market is expected to grow from USD 10.5 billion in 2020 to USD 24.2 billion by 2025, at a CAGR of 18.2% during the forecast period. Major North American vendors in the customer analytics market are Google (US), Microsoft (US), Adobe (US), SAP (Germany), SAS Institute (US), Teradata (US), Oracle (US), Salesforce (US), Mixpanel (US), Manthan System (India), Second Measure (US), Absolute Data (US), NGData (Belgium), Customer Analytics (US), Neustar (US), NICE Systems (Israel), Segment (US), Calibremind (US), Clarity Insight(US), and Amperity (US).",24.2 billion,18.2%
https://www.marketsandmarkets.com/Market-Reports/managed-services-market-1141.html,"The Managed Services Market is expected to grow from USD 223.0 billion in 2020 to USD 329.1 billion by 2025, at a CAGR of 8.1% during the forecast period. The managed services market comprises major providers, such as IBM (US), Cisco (US), Fujitsu (Japan), Accenture (Ireland), Atos (France), DXC Technology (US), AT&T (US), Ericsson (Sweden), Cognizant US), HCL (India), TCS (India), Infosys (India), Dimension Data (South Africa), NTT (Japan), GTT Communications (US), Happiest Minds Technologies (India), Rackspace (US), Huawei (China), Nokia (Finland), and CenturyLink (US). The study includes the in-depth competitive analysis of these key players in the managed services market with their company profiles, recent developments, and key market strategies.",329.1 billion,8.1%
https://www.marketsandmarkets.com/Market-Reports/security-information-event-management-market-183343191.html,"The global Security Information and Event Management (SIEM) market size is expected to grow USD 5.5 billion by 2025, at a CAGR of 5.5% during the forecast period. The major vendors covered in the SIEM market include SolarWinds (US), IBM (US), Micro Focus (UK), Rapid7 (US), RSA (US), McAfee (US), Splunk (US), ManageEngine (US), LogRhythm (US), Sumo Logic (US), Exabeam (US), Securonix (US), Alert Logic (US), Graylog (US), BlackStratus (US), AlienVault (US), Fortinet (US), LogPoint (Europe), Gurucul (US), and Cygilant (US). ",obal Security Information and Event Management (SIEM) market size is expected to grow USD 5.5 billion,5.5%
https://www.marketsandmarkets.com/Market-Reports/mea-wifi-as-a-service-market-202414566.html,"The Middle East and Africa (MEA) Wi-Fi as a Service (WaaS) market size is expected to grow USD 1,094 million by 2025, at a Compound Annual Growth Rate (CAGR) of 26.6% during the forecast period. Major vendors of MEA WaaS include Cisco (US), CommScope (US), HPE (US), Huawei (China), Ubiquiti(US), Extreme Networks (US), Cambium (US), Juniper (US), Fortinet (US), Arista (US), ADTRAN (US), ALE (France), stc (Saudi Arabia), Linksys (US), Cradlepoint (US), TP-Link (China), EnGenius (Singapore), Etisalat (UAE), EZELINK (UAE), NETGEAR (US), WAFAINET (Saudi Arabia), Creative Solutions (Saudi Arabia), Ctelecoms (Saudi Arabia), ExterNetworks (US), du (UAE), AllCAD Solutions (India), Airangel WiFi (UK), and D-Link (Taiwan).",,26.6%
https://www.marketsandmarkets.com/Market-Reports/data-center-rack-market-210971325.html,"MarketsandMarkets estimates the global data center rack market is expected to grow USD 5.9 billion by 2025, at a Compound Annual Growth Rate (CAGR) of 9.4% during the forecast period. The data center rack market comprises major providers, such as Eaton (Ireland), Rittal (Germany), HPE (US), IBM (US), Cisco (US), Fujitsu (Japan), Dell (US), Schneider Electric (France), Vertiv (US), AGC Networks (India), Legrand (France), Oracle (US), Belden (US), nVent (UK), Panduit (US), Great Lakes Data Racks & Cabinets(US), Tripp Lite (US), IMS Engineered Products (US), Rahi Systems (US), and Chatsworth Products (US). The study includes the in-depth competitive analysis of these key players in the data center rack market with their company profiles, recent developments, and key market strategies.",sandMarkets estimates the global data center rack market is expected to grow USD 5.9 billion,9.4%
https://www.marketsandmarkets.com/Market-Reports/carbon-footprint-management-market-136375712.html,"The global carbon footprint management market size is expected to grow USD 12.2 billion by 2025, at a Compound Annual Growth Rate (CAGR) of 6.2% during the forecast period. The major carbon footprint management market vendors include Carbon Footprint (England), Salesforce (US), ENGIE (France), IsoMetrix (South Africa), Schneider Electric (France), Intelex (Canada), IBM (US), SAP (Germany), Enablon (France), Trinity Consultants (US), Dakota Software (US), Envirosoft (Canada), Enviance (US), ProcessMAP (US), Accuvio (Ireland), Carbon EMS (New Zealand), Native Energy (US), EnergyCAP (US), Locus Technologies (US), Ecotrack (US).",obal carbon footprint management market size is expected to grow USD 12.2 billion,6.2%
https://www.marketsandmarkets.com/Market-Reports/gamification-market-991.html,"The gamification market size is projected to grow USD 30.7 billion by 2025, at a Compound Annual Growth Rate (CAGR) of 27.4% during the forecast period. Major vendors of include Microsoft (US), SAP (Germany), BI WORLDWIDE (US), Verint (US) Aon (UK), Hoopla (US), Centrical (US), Mambo.IO (UK), MPS Interactive Systems (India), Influitive (Canada), LevelEleven (US), Ambition (US), Axonify Inc. (Canada), Gamifier (Latin America), IActionable (US), Khoros (US), Scrimmage (US), Xoxoday (India), Tango Card (US), and NIIT (US).",mification market size is projected to grow USD 30.7 billion,27.4%
https://www.marketsandmarkets.com/Market-Reports/contactless-payments-market-1313.html,"The global contactless payment market size is expected to grow USD 18.0 billion by 2025, at a Compound Annual Growth Rate (CAGR) of 11.7% during the forecast period. The major contactless payment market vendors include Gemalto (Netherlands), Infineon (Germany), Ingenico (France) , Wirecard (Germany), Verifone (US), Giesecke+Devrient (Germany), IDEMIA (France), On Track Innovations (Israel), Identiv (US), CPI Card Group (US), Bitel (South Korea), Setomatic Systems (US), Valitor (Iceland), PAX Global Technology (China), MYPINPAD (UK), Mobeewave (Canada), Alcineo (South Africa), Castles (Taiwan), SumUp (UK), and PayCore (Istanbul).",obal contactless payment market size is expected to grow USD 18.0 billion,11.7%
https://www.marketsandmarkets.com/Market-Reports/passenger-information-system-market-200574830.html,"MarketsandMarkets forecasts the global Passenger Information System (PIS) market size is expected to grow USD 42.3 billion by 2025, at a Compound Annual Growth Rate (CAGR) of 12.2% during the forecast period. Major vendors in the global PIS market include Advantech (Taiwan), Alstom (France), Wabtec (U.S.), Cubic (U.S.), Cisco (U.S.), Siemens (Germany), Hitachi (Japan), Huawei (China), Thales (France), Teleste (Finland), Mitsubishi Electric (Japan), ST Engineering (Singapore), Dysten (Poland), Televic (Belgium), Lunetta (India), r2p (Germany), Indra (Spain), ICON Multimedia (Spain), Passio Technologies (US), LANCom (Slovenia), and Simpleway (Czech Republic). ",sandMarkets forecasts the global Passenger Information System (PIS) market size is expected to grow USD 42.3 billion,12.2%
https://www.marketsandmarkets.com/Market-Reports/cognitive-computing-market-136144837.html,"The Cognitive Computing Market is expected to grow from USD 20.5 billion in 2020 to USD 77.5 billion by 2025, at a CAGR of 30.5% during the forecast period. The report includes the study of the key players offering cognitive computing solutions and services. The major vendors Microsoft (US), Google (US), IBM (US), Numenta (US), SAS Institute (US), AWS (US), Enterra Solutions (US), CognitiveScale (US), SparkCognition (US), TCS (India), Expert System (US), Cisco (US), Virtusa (US), Cognitive Software Group (Australia), Red Skios (Spain), Artificial Solutions (Sweden), Acuiti (Australia), Vantage Labs (US), E-Zest (India) and Burstiq (US). It also includes an in-depth competitive analysis of the key players in the cognitive computing market, along with their company profiles, business overviews, product offerings, recent developments, and market strategies.",77.5 billion,30.5%
https://www.marketsandmarkets.com/Market-Reports/enterprise-data-management-market-69219339.html,"The global enterprise data management market size is expected to grow USD 122.9 billion by 2025, at a Compound Annual Growth Rate (CAGR) of 9.5% during the forecast period. The enterprise data management market comprises major solution providers, such as IBM Corporation (US), SAS Institute Inc. (US), Teradata Corporation (US), Oracle Corporation (US), SAP SE (Germany), Talend (US), Symantec (US), Cloudera, Inc. (US), Ataccama (Canada), Informatica (US), Mindtree Limited (India), Qlik (US), EnterWorks, Inc. (US), MapR (US), GoldenSource Corporation (US), Amazon Web Services, Inc. (US), MuleSoft, LLC. (US), Micro Focus International plc (UK), Zaloni, Inc. (US), and Actian (US). The study includes the in-depth competitive analysis of the key players in the enterprise data management market with their company profiles, recent developments, and key market strategies.",obal enterprise data management market size is expected to grow USD 122.9 billion,9.5%
https://www.marketsandmarkets.com/Market-Reports/enterprise-information-archiving-market-253224202.html,"The Global Enterprise Information Archiving Market size to grow from USD 5.7 billion in 2020 to USD 10.8 billion by 2025, at a Compound Annual Growth Rate (CAGR) of 13.5% during period. The major enterprise information archiving vendors operating in the market include Google (US), Microsoft (US), HPE (US), IBM (US), Dell (US), Veritas (US), Barracuda (US), Proofpoint (US), Smarsh (US), Mimecast (UK), ZL Technologies (US), Global Relay (Canada), Micro Focus (UK), OpenText (Canada), Solix (US), Archive360 (US), Everteam (France), Pagefreezer (Canada), Jatheon (Canada), and Unified Global Archiving (US). ",10.8 billion,13.5%
https://www.marketsandmarkets.com/Market-Reports/penetration-testing-market-13422019.html,"The Penetration Testing Market is expected to grow from USD 1.7 billion in 2020 to USD 4.5 billion by 2025, at a CAGR of 21.8% during the forecast period. The major vendors covered in the penetration testing market include Qualys (US), Rapid7 (US), FireEye (US), IBM (US), Micro Focus (Berkshire), Cigita l(Synopses) (US), Secureworks (DELL) (Georgia), Trustwave Holdings(Singtel) (US), Acunetix (Malta), Netsparker (UK), Veracode (Broadcom) (US), Rhino Security Labs(US), Core Security (HelpSystems) (US), Immuniweb (High-Tech Bridge) (Switzerland), Checkmarx (Israel), PortSwigger Web Security (England), Context Information Security (UK), iSECURION (India), BreachLock(US), Raxis (Georgia).",4.5 billion,21.8%
https://www.marketsandmarkets.com/Market-Reports/lawful-interception-market-1264.html,"The Lawful Interception Market is expected to grow from USD 3.6 billion in 2020 to USD 8.8 billion by 2025, at a CAGR of 19.7% during the forecast period. Major vendors operating in the lawful interception market include Utimaco GmbH (Germany), Vocal Technologies (US), AQSACOM, Inc. (France), Verint (US), BAE Systems (UK), Cisco Systems (US), Ericsson (Sweden), Atos (France), SS8 Networks, Inc. (US), Trovicor Networks (UAE), Matison (Croatia), Shoghi Communications Ltd (India), Comint Systems and Solutions Pvt Ltd. (India), Signalogic (US), IPS S.P.A (Rome), Tracespan Communications (Israel), Accuris Networks Inc. (Ireland), EVE Compliancy Solutions (Netherlands), Squire Technologies Ltd. (Netherlands).",8.8 billion,19.7%
https://www.marketsandmarkets.com/Market-Reports/customer-data-platform-market-94223554.html,"The Customer Data Platform Market is expected to grow from USD 2.4 billion in 2020 to USD 10.3 billion by 2025, at a CAGR of 34.0% during the forecast period. These solutions offers more flexible, scalable, and cheaper data storage solutions than traditional data warehousing solutions, along with offering improved analytics capacity. Many CDP solution providers in North America are experimenting in the market by integrating advanced big data and analytics technologies with their existing CDP solutions. They are also adopting various growth strategies to strengthen their positions in the overall market. Major North American vendors in the CDP market are Oracle (US), Adobe (US), Salesforce (US), Microsoft (US), SAS (US), Teradata (US), Dun & Bradstreet (US), Leadspace (US), Zylotech (US), CaliberMind (US), Tealium (US), AgilOne (US), BlueConic (US), Lytics (US), IgnitionOne (US), and Amperity (US).",10.3 billion,34.0%
https://www.marketsandmarkets.com/Market-Reports/physical-iam-market-235309861.html,"The global physical identity and access management market size is expected to grow USD 1,535 million by 2025, at a Compound Annual Growth Rate (CAGR) of 14.2% during the forecast period. The major vendors covered in the physical identity and access management market include HID Global (US), AlertEnterprise (US), IDCUBE (India), Micro Focus (UK), Okta (US), Access Security Corporation (US), Gemalto (Netherlands), IBM (US), Oracle (US), AWS (US), Avatier (US), Wallix Group (France), Atos (France), Identiv (US), Nexus Group (Sweden), Alfrednet (Bucharest), Wipro (India), One Identity (US), Sequr (US), E&M Technologies (US), and WSO2 (US).",,14.2%
