https://www.marketsandmarkets.com/Market-Reports/customer-communications-management-market-189040627.html,"The Customer Communications Management Market is expected to grow from USD 1.3 billion in 2021 to USD 2.2 billion by 2026, at a CAGR of 11.2% during the forecast period. Major vendors in the global CCM market include Adobe(US), Oracle(US), OpenText(US), Zendesk(US), Newgen Software(India), Capgemini(France), Quadient(France), Smart Communications(England), Sefas(France), CEDAR CX Technologies(US), Messagepoint(Canada), Doxim(Canada), Topdown(US), Napersoft(US), Ecrion(US), Doxee(Italy), Papyrus Software(Austria), Hyland(US), Bitrix24(US), Braze(US), HelpCrunch(US), AdventSys(India), Front(US), Trengo(Netherlands), Podium(US), Pitney Bowes(US).",2.2 billion,11.2%
https://www.marketsandmarkets.com/Market-Reports/law-enforcement-software-market-8292078.html,"The Law Enforcement Software Market is expected to grow from USD 12.6 billion in 2020 to USD 22.1 billion by 2026, at a CAGR of 9.8% during the forecast period. The major players have implemented various growth strategies to expand their global presence and increase their market shares. Key players such as IBM, Accenture, Motorola Solutions, Axon, and NICE have majorly adopted many growth strategies, such as new product launches, acquisitions, and partnerships, to expand their product portfolios and grow further in the law enforcement software market.",22.1 billion,9.8%
https://www.marketsandmarkets.com/Market-Reports/network-as-a-service-market-94208411.html,"The Network as a Service Market is expected to grow from USD 10.4 billion in 2021 to USD 37.5 billion by 2026, at a CAGR of 29.4% during the forecast period. Key and innovative vendors in NaaS market are AT&T (US), Verizon (US), Telefonica (Spain), NTT Communications(Japan), Orange Business Services(France), Vodafone (UK), BT Group(London), Tata Communications(India), Lumen(US), Masergy(US), Servsys(US), TELUS(Canada), PCCW Global(China), KDDI(Japan), Cloudflare(US), ARYAKA NETWORKS(US), China Telecom(China), China Mobile(China), Singtel(Singapore), GTT Communications(US), Telia(Sweden), Telstra(Australia), Deutsche Telekom(Germany), Colt Technology Services(UK), HGC(China), TenFour(US),PacketFabric(US), OnX Canada(Canada), Megaport(Australia), Wipro(India), Epsilon(Singapore), Axians(France), IPC Tech(US), and Microland(India).",37.5 billion,29.4%
https://www.marketsandmarkets.com/Market-Reports/multifactor-authentication-market-231220047.html,"The Multi-Factor Authentication Marketis expected to grow from USD 11.1 billion in 2021 to USD 23.5 billion by 2026, at a CAGR of 16.2% during the forecast period. Key and innovative vendors in the MFA market include Micro Focus (UK), Broadcom (US), Microsoft (US), OneSpan (US), Okta (US), Thales (France), RSA Security (US), Duo Security (US), Ping Identity (US), HID Global (US), ESET (Slovakia), ForgeRock (US), CyberArk (US), OneLogin (US), SecureAuth (US), Oracle (US), Salesforce (US), Secret Double Octopus (Israel), Silverfort (Israel), Trusona (US), FusionAuth (US), HYPR (US), Keyless (US), and Luxchain (Hong Kong).",23.5 billion,16.2%
https://www.marketsandmarkets.com/Market-Reports/queue-management-system-market-23961354.html,"The Queue Management System Market is expected to grow from USD 0.5 billion in 2020 to USD 0.6 billion by 2026, at a CAGR of 4.0% during the forecast period. Major vendors in the QMS market include Advantech (Taiwan), Wavetec (Dubai), Aurionpro (India), Lavi Industries (US), QLess (US), Qmatic (Europe), SEDCO (UAE), Q-nomy (US), Core Mobile (US), MaliaTec (Lebanon), JRNI (England), Qudini (England), Qminder (UK), ATT Systems (India), XIPHIAS (India), AKIS Technologies (Europe), AwebStar (Singapore), Xtreme Media (India), Skiplino (Bahrain), Business Automation (Bangladesh), Udentify (Turkey), 2Meters (Germany), OnlineToken (US), Hate2wait (India), VersionX (India). These QMS vendors have adopted various organic and inorganic strategies to sustain their positions and increase their market shares in the global QMS market.",0.6 billion,4.0%
https://www.marketsandmarkets.com/Market-Reports/bare-metal-cloud-market-153940759.html,"The bare metal cloud market size is estimated to grow from USD 0.87 Billion in 2016 to USD 4.71 Billion by 2021, at a Compound Annual Growth Rate (CAGR) of 40.1%. The major forces driving the bare metal cloud market are the growing need for high-performance computing and reliable load balancing of data-intensive and latency-sensitive operations. Moreover, the necessity of non-locking compute & storage resources, advent of fabric virtualization, and the need for noiseless neighbors & hypervisor tax are some of the factors that are driving the market.",,40.1%
https://www.marketsandmarkets.com/Market-Reports/data-centric-security-market-1504980.html,"The global Data-centric Security market size is expected to reach USD 9.8 billion by 2026, at a Compound Annual Growth Rate (CAGR) of 23.1% during the forecast period. Informatica (US), NetApp (US), IBM (US), Broadcom (US), Microfocus (US), Varonis Systems (US), Talend (US), OrangeCyberdefense (France), Forcepoint (US), Imperva (US), PKWARE (US), Seclore (US), Fasoo (South Korea), Protegrity (US), Egnyte (US), Netwrix (US), Digital Guardian (US), Securiti (US), HelpSystems (US), BIGID (US), Lepide (US), NextLabs (US), SealPath (Spain), Nucleus Cyber (archTis) (US), Secupi (US), Dathena (Singapore), Infogix (US), and Concentric.ai (US) are some of the key players considered in the Data-centric Security market. Companies offering Data-centric Security currently focus on inorganic strategies, such as partnerships, collaborations, acquisitions, and mergers, to be competitive in the market.",obal Data-centric Security market size is expected to reach USD 9.8 billion,23.1%
https://www.marketsandmarkets.com/Market-Reports/dns-dhcp-ip-address-management-ddi-market-162005891.html,"The DDI Market is expected to grow from USD 400 million in 2021 to USD 836 million by 2026, at a CAGR of 15.9% during the forecast period. Major vendors in the global DDI market include Nokia Corporation (France), BlueCat Networks (Canada), Microsoft Corporation (US), Infoblox (US), Cisco Systems (US), Men & Mice (Iceland), EfficientIP (US), BT Diamond IP (US), FusionLayer (Finland), PC Network (US), TCPwave (US), Apteriks (Netherlands), ApplianSys (UK), NCC Group (UK), Solarwinds Network (US), NS1 (US), Empowered Networks (Canada), Datacomm (Indonesia), INVETICO (Australia).",,15.9%
https://www.marketsandmarkets.com/Market-Reports/digital-workplace-market-81457101.html,"The global digital workplace market is expected to grow from USD 22.7 billion in 2020 to USD 72.2 billion by 2026, at a compound annual growth rate (CAGR) of 21.3% during the forecast period.Atos (France), Cognizant (US), IBM (US), Zensar (India), Wipro (India), Infosys (India), Accenture (Ireland), Fujitsu (Japan), HCL Technology (India), DXC Technology (US), NTT Data (Japan), Unisys (US), HPE (US), TCS (India), Sonda (Chile), KissFlow (India), Capgemini (France),",72.2 billion,21.3%
https://www.marketsandmarkets.com/Market-Reports/operational-predictive-maintenance-market-8656856.html,"The Predictive Maintenance Market is expected to grow from USD 4.0 billion in 2020 to USD 12.3 billion by 2025, at a CAGR of 25.2% during the forecast period. Major vendors in the global predictive maintenance market include IBM (US), Microsoft (US), SAP (Germany), Hitachi (Japan), PTC (US), GE (US), Schneider Electric (France), Software AG (Germany), SAS (US), TIBCO (US), C3 IoT (US), Uptake (US), Softweb Solutions (US), Asystom (France), Ecolibrium Energy (India), Fiix Software (Canada), OPEX Group (UK), Dingo (Australia), Sigma Industrial Precision (Spain), Google (US), Oracle (US), HPE (US), AWS (US), Micro Focus (US), Splunk (US), Altair (US), RapidMiner (US), ReliaSol (Netherlands), and Seebo (US).",12.3 billion,25.2%
https://www.marketsandmarkets.com/Market-Reports/insurance-analytics-market-58298536.html,"The insurance analytics market is expected to grow from USD 8.8 billion in 2020 to USD 20.6 billion by 2026, at a compound annual growth rate (CAGR) of 15.1% during the forecast period.such as IBM(US), Salesforce(US), Oracle(US), Microsoft(US), Sapiens (Israel), OpenText (Canada), SAP (Germany), Verisk Analytics (US), SAS Institute (US), Vertafore (US), TIBCO (US), Qlik (US), Board International (Switzerland), BRIDGEi2i (US), MicroStrategy (US), Guidewire Software (US), LexisNexis Risk Solutions (US), WNS (India), Hexaware Technologies (India), Pegasystems (US), Applied Systems (US), InsuredMine (US), ReFocus AI (US), RiskVille (Ireland), Pentation Analytics (US), Habit Analytics (US), Artivatic.ai (India), CyberCube (US), and Arceo.ai (US).",20.6 billion,15.1%
https://www.marketsandmarkets.com/Market-Reports/enterprise-platform-as-a-service-paas-market-814.html,"The Platform as a Service (PaaS) Market is expected to grow from USD 56.2 billion in 2020 to USD 164.3 billion by 2026, at a CAGR of 19.6% during the forecast period. The PaaS market comprises major providers, such as AWS (US), Microsoft (US), Alibaba Cloud (China), IBM (US), Salesforce (US), Google (US), Oracle (US), SAP (Germany), Mendix (US), Zoho Corporation (India), Engine Yard (US), Apprenda (US), VMware (US), ServiceNow (US), Plesk (Switzerland), Render (US), CircleCI (US), Tray.io (US), Cloud 66 (UK), AppHarbor (US), Jelastic (US), Platform.sh (France), Scalingo (France), PythonAnywhere (US), and Blazedpath (US). The study includes an in-depth competitive analysis of key players in the PaaS market with their company profiles, recent developments, COVID-19 developments, and key market strategies.",164.3 billion,19.6%
https://www.marketsandmarkets.com/Market-Reports/smart-ticketing-market-28668442.html,"The global smart ticketing market size is projected to reach USD 16.2 billion by 2026, at a Compound Annual Growth Rate (CAGR) of 14.5% during the forecast period. Key and innovative vendors in the smart ticketing market include ACT (England), Atsuke (France), Cammax (England), Conduent (US), Confidex (Finland), Corethree (England), Cubic (US), Flowbird Group (France), Giesecke+Devrient (Germany), HID Global (US), Hitachi Rail (Italy), IDEMIA (France), Indra (Spain), Infineon Technologies (Germany), INIT (Germany), LIT Transit (Slovenia), Masabi (England), NXP Semiconductors (Netherland), PayiQ (Finland), Scheidt & Bachmann (Germany), SecuTix (Switzerland), Siemens (Germany), Thales (France), Ticketer (England), and Xerox (US).",obal smart ticketing market size is projected to reach USD 16.2 billion,14.5%
https://www.marketsandmarkets.com/Market-Reports/contact-center-software-market-257044641.html,"The Contact Center Software Market is expected to grow from USD 24.1 billion in 2020 to USD 75.5 billion by 2026, at a CAGR of 20.9% during the forecast period. The contact center software market comprises major providers, such as NICE (Israel), Genesys (US), Cisco (US), Avaya (US), Five9 (US), Talkdesk (US), Vonage (US), 8x8 (US), AWS (US), Atos (France), Alcatel-Lucolent Enterprise (France), SAP (Sweden), Oracle (US), RingCentral (US), IBM (US), Lifesize (US), Content Guru (UK), Aspect Software (US), Enghouse Interactive (US), 3CLogic (US), Ameyo (India), Verizon (US), Intrado (US), AT&T (US), BT (UK), Twilio (US), Vocalcom (France), NEC (Japan), Evolve IP (US), Mitel (Canada), and ZTE (China). The study includes an in-depth competitive analysis of key players in the contact center software market with their company profiles, recent developments, COVID-19 developments, and key market strategies.",75.5 billion,20.9%
https://www.marketsandmarkets.com/Market-Reports/federated-learning-solutions-market-151896843.html,"The Federated Learning Solutions Market is expected to grow from USD 117 million in 2023 to USD 201 million by 2028, at a CAGR of 11.4% during the forecast period. Major vendors in the global federated learning solutions market include include NVIDIA (US), Cloudera (US), IBM (US), Microsoft (US), Google (US), Owkin (US), Intellegens (UK), DataFleets (US), Edge Delta (US), Enveil (US), Lifebit (UK), Secure AI Labs (US), Sherpa.ai (Spain), Decentralized Machine Learning (Singapore), and Consilient (US).",,11.4%
https://www.marketsandmarkets.com/Market-Reports/cloud-professional-services-market-13244138.html,"The Cloud Professional Services Market is expected to grow from USD 14.2 billion in 2020 to USD 37.0 billion by 2026, at a CAGR of 17.2% during the forecast period. The cloud professional services market includes major vendors, such as are Accenture (Ireland), IBM (US), Deloitte (UK), EY (UK), PwC (UK), HPE (US), Wipro (India), HCL (India), TCS (India), Capgemini (France), Atos (France), Cisco (US), Cognizant (India), DXC (US), Hitachi Vantara (US), Infosys (India), LTI (India), NTT Data (Japan), Rackspace (US), T-Systems (Germany), AWS (US), Google (US), Microsoft (US), Fujitsu (Japan), and Alibaba Cloud (China).",37.0 billion,17.2%
https://www.marketsandmarkets.com/Market-Reports/email-encryption-market-182623205.html,"The global email encryption market size is projected to reach USD 11.8 billion by 2026, at a Compound Annual Growth Rate (CAGR) of 23.1% during the forecast period. Key and innovative vendors in the email encryption market include Micro Focus (UK), Broadcom (US), Cisco (US), Trend Micro (Japan), Sophos (UK), Proofpoint (US), BAE Systems (UK), Zix (US), Entrust Datacard (US), Mimecast (UK), Egress Software (UK), ProtonMail (Switzerland), Trustifi (US), Barracuda Networks (US), Intemedia (US), Clearswift (UK), Virtru (US), Echoworx (Canada), NeoCertified (US), Deltagon (Finland), DeliverySlip (US), Hornetsecurity (Germany), Datamotion (US), Virtru (US), Smarsh (US), Retarus (Germany), Lux Sci (US), Cryptzone (US), SecureAge Technology (Singapore), Paubox (US), Sendinc (US), and Frama (Denmark).",obal email encryption market size is projected to reach USD 11.8 billion,23.1%
https://www.marketsandmarkets.com/Market-Reports/industrial-iot-platform-market-11186318.html,"The IIoT Platform Market is expected to grow from USD 6.0 billion in 2020 to USD 13.7 billion by 2026, at a CAGR of 14.8% during the forecast period. Major vendors operating in the IIoT platform market include Software AG (Germany), PTC Inc. (US), Hitachi, Ltd. (Japan), IBM Corporation (US), Microsoft Corporation (US), Cisco Systems, Inc. (US), Intel Corporation (US), SAP SE (Germany), Siemens AG (Germany), Accenture PLC (US), Atos SE (France), Amazon Web Services (US), Oracle Corporation (US), Bosch.IO (US), Schneider Electric SE (France), Davra Networks Ltd. (US), Eurotech (Italy), Altizon (US), QiO Technologies (UK), Litmus Automation (US), ROOTCLOUD (China), Flutura (US), Augury (US), FogHorn (US), and Samsara (US).",13.7 billion,14.8%
https://www.marketsandmarkets.com/Market-Reports/5g-iot-market-164027845.html,"The 5G IoT Market is expected to grow from USD 2.6 billion in 2021 to USD 40.2 billion by 2026, at a CAGR of 73.0% during the forecast period. Key and innovative vendors in the 5G IoT market include China Mobile (China), AT&T (US), Verizon (US), T-Mobile (US), Vodafone (UK), Orange S.A (France), Telefonica (Spain), SK Telecom (South Korea), Deutsche Telekom (Germany),Ericsson(Sweden), Huawei(China), Nokia(Finland), Samsung (South Korea), Cisco(US),NEC(Japan), Sierra Wireless (Canada), Thales(France), Telit(UK), Quectel(China), SIMCom(China), GosuncnWelink(China), Neoway(China), Fibocom(China), u-blox(Switzerland), and Sequans(France).",40.2 billion,73.0%
https://www.marketsandmarkets.com/Market-Reports/voice-biometrics-market-104503105.html,"The Voice Biometrics Market is expected to grow from USD 1.1 billion in 2020 to USD 3.9 billion by 2026, at a CAGR of 22.8% during the forecast period. Major vendors in the voice biometrics market include Nuance (US), NICE (Israel), Verint (US), Pindrop (US), LexisNexis Risk Solutions (US), Phonexia (Czech Republic), VBG (US), Aculab (UK), Auraya (Australia), OneVault (South Africa), Aware (US), SpeechPro (US), LumenVox (US), Uniphore (India), SESTEK (Turkey), VoicePIN (Poland), QSS Technosoft (India), Voxta (India) Interactions (US), ID R&D (US), Kaizen Secure Voiz (US), HYPR (US), Element (US), Trust Stamp (US), and AnyVision (Israel).These voice biometrics vendors have adopted various organic and inorganic strategies to sustain their positions and increase their market shares in the global voice biometrics market.",3.9 billion,22.8%
https://www.marketsandmarkets.com/Market-Reports/emotion-detection-recognition-market-23376176.html,"The global emotion detection and recognition market is expected to grow from USD 19.5 billion in 2020 to USD 37.1 billion by 2026, at a compound annual growth rate (CAGR) of 11.3% during the forecast period.NEC Global (Japan), IBM (US), Intel (US), Microsoft (US), Apple (US), Gesturetek (Canada), Noldus Technology (Netherlands), Google (US), Tobii (Sweden), Cognitec Systems (Germany), Cipia Vision Ltd (Formerly Eyesight Technologies) (Israel), iMotions (Denmark), Numenta (US), Elliptic Labs (Norway), Kairos (US), PointGrab (US), Affectiva (US), nViso (Switzerland), Beyond Verbal (Israel), Sightcorp (Holland), Crowd Emotion (UK), Eyeris (US), Sentiance (Belgium), Sony Depthsense (Belgium), Ayonix (Japan), and Pyreos (UK).",37.1 billion,11.3%
https://www.marketsandmarkets.com/Market-Reports/data-fabric-market-237314899.html,"The Data Fabric Market is expected to grow from USD 1.0 billion in 2020 to USD 4.2 billion by 2026, at a CAGR of 26.3% during the forecast period. Major vendors in the global data fabric market include Denodo Technologies (US), Global IDs (US), IBM Corporation (US), Informatica (US), NetApp (US), Oracle Corporation (US), SAP SE (Germany), Software AG (Germany), Splunk (US), Talend (US), Dell Technologies (US), HP Enterprise (US), Teradata Corporation (US), TIBCO Software (US), Precisely (US), Idera (US), Nexla (US), Stardog (US), Gluent (US), Starburst Data (US), HEXstream (US), QOMPLX (US), CluedIn (Denmark), Iguazio (Israel), and Cinchy (Canada).",4.2 billion,26.3%
https://www.marketsandmarkets.com/Market-Reports/mobile-wireless-backhaul-market-1034.html,"The global Mobile and wireless backhaul Market is expected to grow from USD 9.3 billion in 2020 to USD 15.5 billion by 2026, at a compound annual growth rate (CAGR) of 8.8% during the forecast period.Ericssom(Sweden), Huawei(China), Nokia(Finland), NEC Corporation(Japan), ZTE(China), Fujitsu(Japan), Broadcom(US), Ceragon(Israel), Aviat(US), and SIAE(Italy). ",15.5 billion,8.8%
https://www.marketsandmarkets.com/Market-Reports/smart-shelf-market-101938228.html,"The Smart Shelves Market is expected to grow from USD 1.8 billion in 2020 to USD 7.1 billion by 2026, at a CAGR of 25.1% during the forecast period. Happiest minds (India), Intel (US), PCCW Solutions (Hong Kong), Avery Dennison (US), Honeywell (US), Huawei Technologies Co. Ltd (China), NXP Semiconductor (The Netherland), E-Ink Holdings (Taiwan), Samsung Electronics (South Korea), DIEBOLD NIXDORF, Incorporated (US), Software AG (Germany), SoluM (South Korea), MINEW (China), TraxRetail (Singapore), NEXCOM (Taiwan), Pricer (Sweden), Dreamztech Solutions Inc (US), Sennco Solutions, Inc (US), Tronitag (Germany), MAGO S.A. (Poland), SES-IMAGOTAG (France), AWM Smart Shelf (US), Wiseshelf (Israel), Trigo (Israel), Caper (US), Zippin (US), and Focal Systems (UK) are some of the key players considered in the smart shelves market.",7.1 billion,25.1%
https://www.marketsandmarkets.com/Market-Reports/smart-advisor-market-72302363.html,"The Chatbot Market is expected to grow from USD 2.9 billion in 2020 to USD 10.5 billion by 2026, at a CAGR of 23.5% during the forecast period. Major vendors in the chatbot market include IBM (US), Microsoft (US), Google (US), AWS (US), Nuance (US), Oracle (US), Creative Virtual (UK), Artificial Solutions (Spain), Kore.ai (US), Inbenta (US), [24]7.AI (US), Aivo (Argentina) ServiceNow (US), Conversica (US), Personetics (US), LiveChat (Poland), MindMeld (US), CogniCor (US), Gupshup (US), Contus (India), Chatfuel (US), KeyReply (Singapore), SmartBots (US), Yellow Messenger (India), Kevit (India), Yekaliva (India), and Pypestream (US). These chatbot vendors have adopted various organic and inorganic strategies to sustain their positions and increase their market shares in the global chatbot market.",10.5 billion,23.5%
https://www.marketsandmarkets.com/Market-Reports/logistics-automation-market-83657139.html,"The Logistics Automation Market is expected to grow from USD 48.4 billion in 2020 to USD 88.9 billion by 2026, at a CAGR of 10.6% during the forecast period. Key and innovative vendors in the logistics automation market include 6 River Systems (US), ABB (Switzerland), BEUMER Group (Germany), Blue Yonder (US), Daifuku (Japan), Dematic (US), E&K Automation (Germany), Eyesee (Hardis Group) (France), Falcon Autotech (India), GreyOrange (US), HighJump (Korber) (US), Honeywell Intelligrated (US), Jungheinrich (Germany), Knapp (Austria), Locus Robotics (US), Manhattan Associates (US), Murata Machinery (Japan), Oracle (US), SAP (Germany), SBS Toshiba Logistics (Japan), Seegrid (US), SSI Schaefer (Germany), Swisslog (Switzerland), System Logistics (Italy), TGW Logistics Group (Austria), and Zebra Technologies (US).",88.9 billion,10.6%
https://www.marketsandmarkets.com/Market-Reports/simulation-software-market-263646018.html,"The global simulation software market size is expected to grow from USD 12.7 billion in 2020 to USD 26.9 billion by 2026, at a Compound Annual Growth Rate (CAGR) of 13.2% during the forecast period. Major vendors in the global Simulation Software market include MathWorks (US), Autodesk (US), Ansys (US), Siemens AG (Germany), PTC (US), Dassault Systemes (France), Altair Engineering (US), MSC Software (US), Honeywell (US), Keysight Technologies (US), Aveva (UK), Spirent Communications (UK), Bentley Systems (US), Synopsys (Canada), AVL List GmbH (Austria), COMSOL (England), Certara (US), CAE (Presagis (Canada)), aPriori (US), PTV Group (Germany), AnyLogic (US), SimScale (Germany), Scalable Networks (US), Simul8 Corporation (UK), FlexSim (US), MOSIMTEC (US), Simio (US), ProSim (US), Cybernet (US), and Cesim (Finland).",26.9 billion,13.2%
https://www.marketsandmarkets.com/Market-Reports/ai-governance-market-176187291.html,"The AI Governance Market is expected to grow from USD 50 million in 2020 to USD 1,016 million by 2026, at a CAGR of 65.5% during the forecast period. Major vendors in the global AI governance market include Alphabet Inc. (US), Microsoft Corporation (US), IBM Corporation (US), Amazon Web Services, Inc. (US), QlikTech International AB (US), TIBCO Software Inc. (US), SAS Institute Inc. (US), Facebook, Inc. (US), SAP SE (Germany), Salesforce.com, Inc. (Salesforce), FICO (US), Zest AI (US), Pymetrics Inc. (US), H2O.ai, Inc. (US), Informatica LLC (US), Ataccama Corporation (Canada), DataRobot, Inc. (US), Dataiku (US), Kyndi, Inc. (US), SparkCognition, Inc. (US), Fiddler Labs, Inc. (US), DarwinAI (Canada), Truera (US), Genie AI Ltd. (UK), MindsDB Inc. (US), integrate.ai Inc. (Canada), Untangle AI Pte Ltd (Singapore), AnotherBrain (France), Diveplane Corporation (US), and 2021.AI (Denmark).",,65.5%
https://www.marketsandmarkets.com/Market-Reports/green-data-center-gdc-market-1032.html,"The green data center market is expected to grow from USD 49.2 billion in 2020 to USD 140.3 billion by 2026, at a compound annual growth rate (CAGR) of 19.1% during the forecast period.Schneider Electric (France), Vertiv (US), Hewlett Packard Enterprise (US), Green Revolution Cooling (US), Midas Green Technologies (US), Delta Electronics (Taiwan), Rittal (Germany), Eaton (Ireland), Cisco (US), Nortek Air Solutions (US), Dell Technologies (US), Asetek (Denmark), Airedale (UK),Lenovo (Hong Kong), Fujitsu (Japan), Cyber Power Systems (US), Super Micro (US), Tripp Lite (US), Inspur (China), CDP Energy (US), Bxterra Power Technology (US), ZutaCore(US), Submer (Spain), DCX The Liquid Cooling Company (Poland), and Liqit.io (Ukrain).",140.3 billion,19.1%
https://www.marketsandmarkets.com/Market-Reports/business-process-automation-market-197532385.html,"The global Business Process Automation (BPA) market size is expected to grow from USD 9.8 billion in 2020 to USD 19.6 billion by 2026, at a Compound Annual Growth Rate (CAGR) of 12.2% during the forecast period. The BPA market is dominated by companies such as IBM (US), Pegasystems (US), Appian (US), Kissflow(India), Laserfiche (US), Nintex (US), Oracle (US), Software AG (Germany), Salesforce (US) Microsoft (US) , Bizagi (UK), OpenText (Canada), TIBCO (US), Creatio (US), Genpact (US), DXC Technology (UK), Newgen Software (India), Bonitasoft (France), Kofax (US), FlowForma (Ireland), AuraQuantic (US), AgilePoint (US), Automation Hero (US), Quickbase (US), and, Cortex (UK). These vendors have a large customer base and strong geographic footprint along with organized distribution channels, which helps them to increase revenues.",19.6 billion,12.2%
